id,content,creator_id,date_created,date_modified
371,"Maecenas rhoncus aliquam lacus. Morbi quis tortor id nulla ultrices aliquet. Maecenas leo odio, condimentum id, luctus nec, molestie sed, justo.",2,2022-04-28T21:35:27+02:00,2022-04-29T21:35:27+02:00
372,Sed ante. Vivamus tortor. Duis mattis egestas metus.,180,2022-01-04T15:51:35+01:00,2022-01-05T15:51:35+01:00
373,"Integer pede justo, lacinia eget, tincidunt eget, tempus vel, pede. Morbi porttitor lorem id ligula. Suspendisse ornare consequat lectus.",26,2022-01-31T22:47:53+01:00,2022-02-01T15:47:53+01:00
374,Quisque ut erat. Curabitur gravida nisi at nibh.,128,2022-09-13T00:20:23+02:00,2022-09-13T16:20:23+02:00
375,Curabitur convallis.,92,2022-03-18T23:21:31+01:00,2022-03-19T23:21:31+01:00
376,"Proin interdum mauris non ligula pellentesque ultrices. Phasellus id sapien in sapien iaculis congue. Vivamus metus arcu, adipiscing molestie, hendrerit at, vulputate vitae, nisl.",43,2022-10-07T05:51:38+02:00,2022-10-08T00:51:38+02:00
377,"Nam congue, risus semper porta volutpat, quam pede lobortis ligula, sit amet eleifend pede libero quis orci.",96,2023-01-24T05:15:54+01:00,2023-01-24T20:15:54+01:00
378,"Nam ultrices, libero non mattis pulvinar, nulla pede ullamcorper augue, a suscipit nulla elit ac nulla. Sed vel enim sit amet nunc viverra dapibus. Nulla suscipit ligula in lacus.",179,2021-08-16T20:14:33+02:00,2021-08-17T09:14:33+02:00
379,"Mauris enim leo, rhoncus sed, vestibulum sit amet, cursus id, turpis. Integer aliquet, massa id lobortis convallis, tortor risus dapibus augue, vel accumsan tellus nisi eu orci.",100,2022-01-24T07:20:34+01:00,2022-01-24T23:20:34+01:00
380,Nulla tellus.,53,2022-06-28T15:13:26+02:00,2022-06-29T01:13:26+02:00
381,"Nulla neque libero, convallis eget, eleifend luctus, ultricies eu, nibh. Quisque id justo sit amet sapien dignissim vestibulum. Vestibulum ante ipsum primis in faucibus orci luctus et ultrices posuere cubilia Curae; Nulla dapibus dolor vel est.",146,2021-12-28T15:46:20+01:00,2021-12-28T17:46:20+01:00
382,Vestibulum ante ipsum primis in faucibus orci luctus et ultrices posuere cubilia Curae; Duis faucibus accumsan odio. Curabitur convallis.,191,2022-05-26T00:31:33+02:00,2022-05-26T10:31:33+02:00
383,Vestibulum ante ipsum primis in faucibus orci luctus et ultrices posuere cubilia Curae; Nulla dapibus dolor vel est.,199,2022-07-30T12:27:57+02:00,2022-07-31T00:27:57+02:00
384,Vestibulum rutrum rutrum neque. Aenean auctor gravida sem.,189,2021-12-24T19:43:14+01:00,2021-12-25T00:43:14+01:00
385,Mauris sit amet eros. Suspendisse accumsan tortor quis turpis.,141,2023-01-25T10:51:54+01:00,2023-01-25T21:51:54+01:00
386,"Fusce congue, diam id ornare imperdiet, sapien urna pretium nisl, ut volutpat sapien arcu sed augue. Aliquam erat volutpat.",112,2022-03-09T02:15:12+01:00,2022-03-10T02:15:12+01:00
387,"Pellentesque viverra pede ac diam. Cras pellentesque volutpat dui. Maecenas tristique, est et tempus semper, est quam pharetra magna, ac consequat metus sapien ut nunc.",59,2022-03-19T19:27:27+01:00,2022-03-20T10:27:27+01:00
388,Aliquam quis turpis eget elit sodales scelerisque. Mauris sit amet eros. Suspendisse accumsan tortor quis turpis.,91,2021-09-21T16:45:13+02:00,2021-09-21T20:45:13+02:00
389,"Maecenas leo odio, condimentum id, luctus nec, molestie sed, justo. Pellentesque viverra pede ac diam. Cras pellentesque volutpat dui.",161,2021-12-21T07:05:39+01:00,2021-12-21T09:05:39+01:00
390,"Praesent blandit. Nam nulla. Integer pede justo, lacinia eget, tincidunt eget, tempus vel, pede.",121,2021-08-20T21:44:24+02:00,2021-08-21T17:44:24+02:00
391,"Integer non velit. Donec diam neque, vestibulum eget, vulputate ut, ultrices vel, augue.",41,2022-10-08T03:55:56+02:00,2022-10-08T17:55:56+02:00
392,Suspendisse potenti.,79,2021-08-31T13:54:38+02:00,2021-09-01T01:54:38+02:00
393,In hac habitasse platea dictumst.,169,2022-09-20T01:02:20+02:00,2022-09-20T19:02:20+02:00
394,Integer a nibh. In quis justo. Maecenas rhoncus aliquam lacus.,167,2021-11-10T17:30:50+01:00,2021-11-10T23:30:50+01:00
395,Integer a nibh. In quis justo.,134,2022-02-21T16:58:19+01:00,2022-02-21T22:58:19+01:00
396,"Donec odio justo, sollicitudin ut, suscipit a, feugiat et, eros. Vestibulum ac est lacinia nisi venenatis tristique. Fusce congue, diam id ornare imperdiet, sapien urna pretium nisl, ut volutpat sapien arcu sed augue.",37,2022-06-05T08:23:13+02:00,2022-06-05T10:23:13+02:00
397,"Cum sociis natoque penatibus et magnis dis parturient montes, nascetur ridiculus mus. Vivamus vestibulum sagittis sapien. Cum sociis natoque penatibus et magnis dis parturient montes, nascetur ridiculus mus.",182,2022-08-17T20:53:10+02:00,2022-08-17T21:53:10+02:00
398,Mauris sit amet eros. Suspendisse accumsan tortor quis turpis. Sed ante.,99,2022-12-22T01:42:59+01:00,2022-12-22T23:42:59+01:00
399,"Morbi quis tortor id nulla ultrices aliquet. Maecenas leo odio, condimentum id, luctus nec, molestie sed, justo. Pellentesque viverra pede ac diam.",68,2021-10-17T23:11:13+02:00,2021-10-18T20:11:13+02:00
400,Suspendisse potenti. Cras in purus eu magna vulputate luctus.,89,2022-05-19T11:41:01+02:00,2022-05-20T09:41:01+02:00
401,"Cras mi pede, malesuada in, imperdiet et, commodo vulputate, justo. In blandit ultrices enim. Lorem ipsum dolor sit amet, consectetuer adipiscing elit.",191,2022-05-22T04:32:30+02:00,2022-05-22T18:32:30+02:00
402,Aliquam quis turpis eget elit sodales scelerisque.,181,2022-07-05T20:04:48+02:00,2022-07-05T21:04:48+02:00
403,Etiam vel augue.,25,2022-08-25T11:03:19+02:00,2022-08-25T14:03:19+02:00
404,"Vivamus vestibulum sagittis sapien. Cum sociis natoque penatibus et magnis dis parturient montes, nascetur ridiculus mus. Etiam vel augue.",74,2022-07-02T00:23:40+02:00,2022-07-02T17:23:40+02:00
405,"Lorem ipsum dolor sit amet, consectetuer adipiscing elit. Proin interdum mauris non ligula pellentesque ultrices. Phasellus id sapien in sapien iaculis congue.",189,2022-04-06T01:47:12+02:00,2022-04-06T15:47:12+02:00
406,"Donec diam neque, vestibulum eget, vulputate ut, ultrices vel, augue.",79,2021-08-31T06:10:23+02:00,2021-08-31T07:10:23+02:00
407,"Mauris enim leo, rhoncus sed, vestibulum sit amet, cursus id, turpis.",195,2022-04-13T09:20:28+02:00,2022-04-13T19:20:28+02:00
408,Nullam sit amet turpis elementum ligula vehicula consequat. Morbi a ipsum. Integer a nibh.,147,2022-03-09T11:30:21+01:00,2022-03-09T13:30:21+01:00
409,Nunc nisl.,19,2022-07-01T02:43:10+02:00,2022-07-01T22:43:10+02:00
410,In hac habitasse platea dictumst.,164,2022-01-27T16:12:58+01:00,2022-01-27T20:12:58+01:00
411,Phasellus sit amet erat. Nulla tempus. Vivamus in felis eu sapien cursus vestibulum.,18,2022-03-31T02:21:27+02:00,2022-03-31T06:21:27+02:00
412,Etiam pretium iaculis justo. In hac habitasse platea dictumst. Etiam faucibus cursus urna.,7,2022-05-23T01:42:57+02:00,2022-05-23T18:42:57+02:00
413,"Nulla neque libero, convallis eget, eleifend luctus, ultricies eu, nibh. Quisque id justo sit amet sapien dignissim vestibulum.",180,2021-07-26T10:02:20+02:00,2021-07-26T12:02:20+02:00
414,"In tempor, turpis nec euismod scelerisque, quam turpis adipiscing lorem, vitae mattis nibh ligula nec sem.",94,2021-11-15T18:52:05+01:00,2021-11-16T05:52:05+01:00
415,"Lorem ipsum dolor sit amet, consectetuer adipiscing elit.",44,2021-12-21T15:36:22+01:00,2021-12-21T18:36:22+01:00
416,Nullam porttitor lacus at turpis. Donec posuere metus vitae ipsum. Aliquam non mauris.,133,2022-03-22T07:39:43+01:00,2022-03-23T04:39:43+01:00
417,In sagittis dui vel nisl.,106,2021-07-16T20:47:19+02:00,2021-07-17T11:47:19+02:00
418,Pellentesque eget nunc. Donec quis orci eget orci vehicula condimentum.,71,2022-04-02T16:10:33+02:00,2022-04-02T20:10:33+02:00
419,"Maecenas rhoncus aliquam lacus. Morbi quis tortor id nulla ultrices aliquet. Maecenas leo odio, condimentum id, luctus nec, molestie sed, justo.",121,2022-03-05T12:32:32+01:00,2022-03-05T13:32:32+01:00
420,Duis aliquam convallis nunc.,102,2023-01-27T00:45:32+01:00,2023-01-27T11:45:32+01:00
421,"Cum sociis natoque penatibus et magnis dis parturient montes, nascetur ridiculus mus.",83,2022-04-16T00:19:36+02:00,2022-04-16T08:19:36+02:00
422,In quis justo. Maecenas rhoncus aliquam lacus. Morbi quis tortor id nulla ultrices aliquet.,27,2022-07-02T07:09:26+02:00,2022-07-02T08:09:26+02:00
423,Proin interdum mauris non ligula pellentesque ultrices. Phasellus id sapien in sapien iaculis congue.,11,2021-10-09T09:53:47+02:00,2021-10-10T07:53:47+02:00
424,Aliquam sit amet diam in magna bibendum imperdiet.,54,2022-07-08T16:39:39+02:00,2022-07-09T04:39:39+02:00
425,Duis at velit eu est congue elementum. In hac habitasse platea dictumst.,30,2022-01-28T23:01:46+01:00,2022-01-29T15:01:46+01:00
426,"Integer non velit. Donec diam neque, vestibulum eget, vulputate ut, ultrices vel, augue. Vestibulum ante ipsum primis in faucibus orci luctus et ultrices posuere cubilia Curae; Donec pharetra, magna vestibulum aliquet ultrices, erat tortor sollicitudin mi, sit amet lobortis sapien sapien non mi.",20,2022-01-31T08:02:41+01:00,2022-01-31T16:02:41+01:00
427,Morbi porttitor lorem id ligula. Suspendisse ornare consequat lectus.,162,2022-11-30T15:36:56+01:00,2022-11-30T22:36:56+01:00
428,Vestibulum rutrum rutrum neque. Aenean auctor gravida sem.,154,2022-02-01T07:52:54+01:00,2022-02-01T09:52:54+01:00
429,Aliquam erat volutpat. In congue. Etiam justo.,33,2022-09-02T09:42:39+02:00,2022-09-03T06:42:39+02:00
430,Etiam vel augue. Vestibulum rutrum rutrum neque.,88,2021-07-14T22:55:39+02:00,2021-07-15T10:55:39+02:00
431,"Morbi odio odio, elementum eu, interdum eu, tincidunt in, leo. Maecenas pulvinar lobortis est.",193,2022-08-23T19:34:24+02:00,2022-08-24T18:34:24+02:00
432,In eleifend quam a odio. In hac habitasse platea dictumst.,85,2022-02-26T08:11:24+01:00,2022-02-26T18:11:24+01:00
433,Duis bibendum. Morbi non quam nec dui luctus rutrum.,169,2022-09-08T06:17:06+02:00,2022-09-08T11:17:06+02:00
434,"Cum sociis natoque penatibus et magnis dis parturient montes, nascetur ridiculus mus. Etiam vel augue.",40,2023-01-05T12:52:57+01:00,2023-01-05T14:52:57+01:00
435,"Nulla neque libero, convallis eget, eleifend luctus, ultricies eu, nibh. Quisque id justo sit amet sapien dignissim vestibulum.",167,2022-01-04T05:24:56+01:00,2022-01-05T01:24:56+01:00
436,Phasellus sit amet erat. Nulla tempus.,90,2022-05-30T22:02:08+02:00,2022-05-31T19:02:08+02:00
437,"Lorem ipsum dolor sit amet, consectetuer adipiscing elit. Proin risus.",134,2021-12-16T20:40:18+01:00,2021-12-17T10:40:18+01:00
438,Donec semper sapien a libero.,6,2021-12-15T08:06:32+01:00,2021-12-15T16:06:32+01:00
439,"Morbi quis tortor id nulla ultrices aliquet. Maecenas leo odio, condimentum id, luctus nec, molestie sed, justo. Pellentesque viverra pede ac diam.",178,2023-04-15T05:19:23+02:00,2023-04-16T03:19:23+02:00
440,"Mauris ullamcorper purus sit amet nulla. Quisque arcu libero, rutrum ac, lobortis vel, dapibus at, diam.",136,2022-07-03T19:51:34+02:00,2022-07-04T02:51:34+02:00
441,Suspendisse ornare consequat lectus.,76,2022-06-18T02:25:55+02:00,2022-06-18T06:25:55+02:00
442,Morbi non quam nec dui luctus rutrum. Nulla tellus.,48,2022-10-06T05:19:14+02:00,2022-10-06T20:19:14+02:00
443,Donec posuere metus vitae ipsum.,82,2022-01-05T22:17:33+01:00,2022-01-05T23:17:33+01:00
444,"Cum sociis natoque penatibus et magnis dis parturient montes, nascetur ridiculus mus.",131,2022-05-13T05:26:10+02:00,2022-05-13T20:26:10+02:00
445,Donec semper sapien a libero. Nam dui.,129,2022-11-29T15:36:59+01:00,2022-11-30T10:36:59+01:00
446,Suspendisse potenti. In eleifend quam a odio.,123,2022-08-20T01:31:41+02:00,2022-08-20T06:31:41+02:00
447,Mauris lacinia sapien quis libero. Nullam sit amet turpis elementum ligula vehicula consequat. Morbi a ipsum.,188,2022-04-13T01:19:10+02:00,2022-04-13T20:19:10+02:00
448,Proin interdum mauris non ligula pellentesque ultrices. Phasellus id sapien in sapien iaculis congue.,176,2021-11-08T15:17:42+01:00,2021-11-09T11:17:42+01:00
449,Nunc nisl.,138,2021-08-15T16:49:02+02:00,2021-08-16T03:49:02+02:00
450,"Fusce congue, diam id ornare imperdiet, sapien urna pretium nisl, ut volutpat sapien arcu sed augue. Aliquam erat volutpat. In congue.",39,2021-12-25T19:40:55+01:00,2021-12-25T22:40:55+01:00
451,"Fusce congue, diam id ornare imperdiet, sapien urna pretium nisl, ut volutpat sapien arcu sed augue. Aliquam erat volutpat.",141,2023-03-12T16:58:58+01:00,2023-03-12T17:58:58+01:00
452,Vestibulum ante ipsum primis in faucibus orci luctus et ultrices posuere cubilia Curae; Mauris viverra diam vitae quam. Suspendisse potenti.,169,2022-05-29T02:23:09+02:00,2022-05-29T10:23:09+02:00
453,"Aliquam sit amet diam in magna bibendum imperdiet. Nullam orci pede, venenatis non, sodales sed, tincidunt eu, felis. Fusce posuere felis sed lacus.",21,2022-04-22T04:19:03+02:00,2022-04-22T09:19:03+02:00
454,Morbi non quam nec dui luctus rutrum. Nulla tellus.,70,2023-02-23T21:24:16+01:00,2023-02-24T02:24:16+01:00
455,"Vestibulum ante ipsum primis in faucibus orci luctus et ultrices posuere cubilia Curae; Donec pharetra, magna vestibulum aliquet ultrices, erat tortor sollicitudin mi, sit amet lobortis sapien sapien non mi.",52,2022-04-24T01:56:15+02:00,2022-04-25T01:56:15+02:00
456,"Nulla ac enim. In tempor, turpis nec euismod scelerisque, quam turpis adipiscing lorem, vitae mattis nibh ligula nec sem. Duis aliquam convallis nunc.",97,2022-02-01T09:13:42+01:00,2022-02-01T10:13:42+01:00
457,Suspendisse accumsan tortor quis turpis. Sed ante.,158,2022-04-27T14:22:32+02:00,2022-04-27T21:22:32+02:00
458,Cras non velit nec nisi vulputate nonummy. Maecenas tincidunt lacus at velit.,53,2022-04-18T17:27:00+02:00,2022-04-19T03:27:00+02:00
459,Suspendisse potenti. Nullam porttitor lacus at turpis. Donec posuere metus vitae ipsum.,18,2022-05-02T09:35:53+02:00,2022-05-03T04:35:53+02:00
460,Etiam pretium iaculis justo. In hac habitasse platea dictumst. Etiam faucibus cursus urna.,168,2022-02-14T19:11:06+01:00,2022-02-15T13:11:06+01:00
461,Pellentesque at nulla. Suspendisse potenti.,144,2022-06-03T18:03:44+02:00,2022-06-04T07:03:44+02:00
462,"Fusce lacus purus, aliquet at, feugiat non, pretium quis, lectus.",81,2022-01-31T21:28:48+01:00,2022-02-01T07:28:48+01:00
463,Pellentesque eget nunc. Donec quis orci eget orci vehicula condimentum. Curabitur in libero ut massa volutpat convallis.,171,2021-10-24T00:18:16+02:00,2021-10-24T18:18:16+02:00
464,Phasellus id sapien in sapien iaculis congue.,127,2022-06-01T18:50:16+02:00,2022-06-01T23:50:16+02:00
465,"Quisque erat eros, viverra eget, congue eget, semper rutrum, nulla. Nunc purus.",196,2022-09-07T14:14:33+02:00,2022-09-07T19:14:33+02:00
466,Donec quis orci eget orci vehicula condimentum. Curabitur in libero ut massa volutpat convallis.,112,2022-02-04T21:13:12+01:00,2022-02-05T12:13:12+01:00
467,Aenean lectus. Pellentesque eget nunc. Donec quis orci eget orci vehicula condimentum.,16,2022-05-17T02:10:27+02:00,2022-05-17T17:10:27+02:00
468,"Proin leo odio, porttitor id, consequat in, consequat ut, nulla. Sed accumsan felis.",90,2022-11-29T16:56:17+01:00,2022-11-30T15:56:17+01:00
469,In hac habitasse platea dictumst.,98,2021-12-20T20:48:44+01:00,2021-12-21T20:48:44+01:00
470,Etiam vel augue.,102,2022-04-19T08:25:28+02:00,2022-04-19T21:25:28+02:00
471,Donec quis orci eget orci vehicula condimentum.,96,2022-07-13T03:25:28+02:00,2022-07-13T23:25:28+02:00
472,Vestibulum ac est lacinia nisi venenatis tristique.,75,2021-11-16T08:33:09+01:00,2021-11-16T09:33:09+01:00
473,Donec semper sapien a libero.,105,2021-09-12T00:53:10+02:00,2021-09-12T02:53:10+02:00
474,"Duis ac nibh. Fusce lacus purus, aliquet at, feugiat non, pretium quis, lectus. Suspendisse potenti.",131,2022-06-14T21:53:01+02:00,2022-06-15T06:53:01+02:00
475,"Fusce congue, diam id ornare imperdiet, sapien urna pretium nisl, ut volutpat sapien arcu sed augue. Aliquam erat volutpat. In congue.",137,2022-12-31T17:40:31+01:00,2022-12-31T18:40:31+01:00
476,Nullam molestie nibh in lectus. Pellentesque at nulla.,29,2022-07-20T19:12:25+02:00,2022-07-20T20:12:25+02:00
477,In hac habitasse platea dictumst.,55,2022-05-02T09:25:48+02:00,2022-05-03T04:25:48+02:00
478,Donec ut dolor.,181,2022-04-15T18:17:35+02:00,2022-04-15T23:17:35+02:00
479,"Vestibulum quam sapien, varius ut, blandit non, interdum in, ante. Vestibulum ante ipsum primis in faucibus orci luctus et ultrices posuere cubilia Curae; Duis faucibus accumsan odio. Curabitur convallis.",3,2022-09-28T01:57:21+02:00,2022-09-28T18:57:21+02:00
480,Donec ut mauris eget massa tempor convallis.,115,2022-07-03T09:45:05+02:00,2022-07-04T06:45:05+02:00
481,"Vestibulum ac est lacinia nisi venenatis tristique. Fusce congue, diam id ornare imperdiet, sapien urna pretium nisl, ut volutpat sapien arcu sed augue.",194,2022-05-12T15:35:47+02:00,2022-05-13T13:35:47+02:00
482,Nulla tempus.,15,2022-08-08T13:01:25+02:00,2022-08-09T13:01:25+02:00
483,"In est risus, auctor sed, tristique in, tempus sit amet, sem. Fusce consequat.",157,2022-07-19T17:06:29+02:00,2022-07-20T04:06:29+02:00
484,Vestibulum rutrum rutrum neque. Aenean auctor gravida sem.,95,2022-02-07T14:48:48+01:00,2022-02-07T19:48:48+01:00
485,Nulla nisl.,27,2022-08-27T11:02:33+02:00,2022-08-27T22:02:33+02:00
486,Duis consequat dui nec nisi volutpat eleifend.,152,2021-09-26T20:37:01+02:00,2021-09-27T19:37:01+02:00
487,Nulla mollis molestie lorem.,23,2021-10-30T02:09:35+02:00,2021-10-30T23:09:35+02:00
488,"In tempor, turpis nec euismod scelerisque, quam turpis adipiscing lorem, vitae mattis nibh ligula nec sem. Duis aliquam convallis nunc.",41,2022-08-07T20:24:30+02:00,2022-08-08T10:24:30+02:00
489,Sed vel enim sit amet nunc viverra dapibus.,50,2021-10-05T01:07:45+02:00,2021-10-05T12:07:45+02:00
490,Nulla suscipit ligula in lacus. Curabitur at ipsum ac tellus semper interdum.,135,2022-08-29T02:45:40+02:00,2022-08-29T22:45:40+02:00
491,Nullam molestie nibh in lectus. Pellentesque at nulla. Suspendisse potenti.,17,2022-06-14T18:27:50+02:00,2022-06-15T12:27:50+02:00
492,"Fusce posuere felis sed lacus. Morbi sem mauris, laoreet ut, rhoncus aliquet, pulvinar sed, nisl.",132,2022-03-18T17:26:57+01:00,2022-03-18T18:26:57+01:00
493,"Lorem ipsum dolor sit amet, consectetuer adipiscing elit. Proin interdum mauris non ligula pellentesque ultrices.",2,2022-02-03T13:00:08+01:00,2022-02-04T06:00:08+01:00
494,Aliquam quis turpis eget elit sodales scelerisque.,36,2023-03-25T16:02:33+01:00,2023-03-25T23:02:33+01:00
495,In quis justo.,38,2021-10-22T04:44:23+02:00,2021-10-23T03:44:23+02:00
496,Nulla justo. Aliquam quis turpis eget elit sodales scelerisque.,100,2022-07-14T07:56:57+02:00,2022-07-14T09:56:57+02:00
497,Duis aliquam convallis nunc. Proin at turpis a pede posuere nonummy.,11,2021-08-27T06:38:11+02:00,2021-08-28T02:38:11+02:00
498,"Morbi odio odio, elementum eu, interdum eu, tincidunt in, leo. Maecenas pulvinar lobortis est. Phasellus sit amet erat.",117,2021-10-02T08:32:53+02:00,2021-10-03T07:32:53+02:00
499,Donec semper sapien a libero. Nam dui.,37,2022-04-07T18:58:32+02:00,2022-04-07T19:58:32+02:00
500,"Proin leo odio, porttitor id, consequat in, consequat ut, nulla.",12,2022-05-23T16:23:49+02:00,2022-05-24T06:23:49+02:00
501,Nulla ut erat id mauris vulputate elementum. Nullam varius.,34,2022-05-27T19:19:40+02:00,2022-05-28T18:19:40+02:00
502,Duis consequat dui nec nisi volutpat eleifend. Donec ut dolor. Morbi vel lectus in quam fringilla rhoncus.,105,2022-04-11T17:41:13+02:00,2022-04-12T17:41:13+02:00
503,Phasellus sit amet erat. Nulla tempus.,178,2022-12-13T03:04:27+01:00,2022-12-13T11:04:27+01:00
504,Donec semper sapien a libero.,86,2022-01-04T03:25:35+01:00,2022-01-04T07:25:35+01:00
505,Duis consequat dui nec nisi volutpat eleifend. Donec ut dolor. Morbi vel lectus in quam fringilla rhoncus.,102,2022-07-22T02:50:24+02:00,2022-07-22T22:50:24+02:00
506,"Morbi sem mauris, laoreet ut, rhoncus aliquet, pulvinar sed, nisl.",111,2022-03-09T07:34:04+01:00,2022-03-09T10:34:04+01:00
507,Pellentesque ultrices mattis odio.,168,2021-08-10T11:15:43+02:00,2021-08-11T07:15:43+02:00
508,"Integer pede justo, lacinia eget, tincidunt eget, tempus vel, pede. Morbi porttitor lorem id ligula.",142,2022-01-30T17:07:56+01:00,2022-01-30T22:07:56+01:00
509,Donec posuere metus vitae ipsum. Aliquam non mauris. Morbi non lectus.,54,2022-05-12T06:24:41+02:00,2022-05-12T21:24:41+02:00
510,"Praesent lectus. Vestibulum quam sapien, varius ut, blandit non, interdum in, ante.",132,2022-04-19T10:34:04+02:00,2022-04-20T05:34:04+02:00
511,Vestibulum ante ipsum primis in faucibus orci luctus et ultrices posuere cubilia Curae; Mauris viverra diam vitae quam. Suspendisse potenti. Nullam porttitor lacus at turpis.,45,2022-12-02T16:54:11+01:00,2022-12-02T16:54:11+01:00
512,"Mauris enim leo, rhoncus sed, vestibulum sit amet, cursus id, turpis.",92,2021-07-10T03:44:47+02:00,2021-07-10T09:44:47+02:00
513,Etiam vel augue.,49,2022-11-23T00:45:21+01:00,2022-11-23T19:45:21+01:00
514,"In tempor, turpis nec euismod scelerisque, quam turpis adipiscing lorem, vitae mattis nibh ligula nec sem. Duis aliquam convallis nunc. Proin at turpis a pede posuere nonummy.",13,2021-10-20T19:58:07+02:00,2021-10-21T11:58:07+02:00
515,"Aenean sit amet justo. Morbi ut odio. Cras mi pede, malesuada in, imperdiet et, commodo vulputate, justo.",192,2023-01-10T01:59:19+01:00,2023-01-10T20:59:19+01:00
516,Nullam molestie nibh in lectus. Pellentesque at nulla.,182,2022-11-16T08:45:04+01:00,2022-11-17T01:45:04+01:00
517,In sagittis dui vel nisl. Duis ac nibh.,75,2022-05-25T17:34:30+02:00,2022-05-26T14:34:30+02:00
518,Aenean lectus. Pellentesque eget nunc.,150,2022-04-15T23:19:08+02:00,2022-04-16T20:19:08+02:00
519,"Proin risus. Praesent lectus. Vestibulum quam sapien, varius ut, blandit non, interdum in, ante.",172,2022-03-08T12:19:39+01:00,2022-03-08T13:19:39+01:00
520,Mauris lacinia sapien quis libero. Nullam sit amet turpis elementum ligula vehicula consequat. Morbi a ipsum.,77,2022-07-07T04:02:25+02:00,2022-07-07T04:02:25+02:00
521,Suspendisse potenti. Nullam porttitor lacus at turpis. Donec posuere metus vitae ipsum.,53,2022-07-12T07:14:38+02:00,2022-07-12T07:14:38+02:00
522,Morbi non lectus. Aliquam sit amet diam in magna bibendum imperdiet.,160,2022-08-27T03:12:12+02:00,2022-08-27T03:12:12+02:00
523,Nullam molestie nibh in lectus. Pellentesque at nulla.,110,2021-08-06T19:25:25+02:00,2021-08-07T04:25:25+02:00
524,"Pellentesque ultrices mattis odio. Donec vitae nisi. Nam ultrices, libero non mattis pulvinar, nulla pede ullamcorper augue, a suscipit nulla elit ac nulla.",89,2021-12-10T06:29:35+01:00,2021-12-10T16:29:35+01:00
525,Suspendisse accumsan tortor quis turpis.,101,2022-02-08T20:45:57+01:00,2022-02-09T20:45:57+01:00
526,"Phasellus id sapien in sapien iaculis congue. Vivamus metus arcu, adipiscing molestie, hendrerit at, vulputate vitae, nisl. Aenean lectus.",186,2022-02-28T21:29:11+01:00,2022-03-01T20:29:11+01:00
527,Maecenas rhoncus aliquam lacus. Morbi quis tortor id nulla ultrices aliquet.,184,2022-06-27T22:37:11+02:00,2022-06-28T07:37:11+02:00
528,Aliquam quis turpis eget elit sodales scelerisque. Mauris sit amet eros.,11,2022-02-11T01:24:21+01:00,2022-02-11T02:24:21+01:00
529,Etiam vel augue. Vestibulum rutrum rutrum neque. Aenean auctor gravida sem.,37,2022-03-05T19:25:19+01:00,2022-03-06T08:25:19+01:00
530,Nullam varius.,27,2022-03-14T18:04:03+01:00,2022-03-15T07:04:03+01:00
531,"Aenean fermentum. Donec ut mauris eget massa tempor convallis. Nulla neque libero, convallis eget, eleifend luctus, ultricies eu, nibh.",61,2021-12-22T01:03:32+01:00,2021-12-22T10:03:32+01:00
532,"Lorem ipsum dolor sit amet, consectetuer adipiscing elit. Proin risus. Praesent lectus.",32,2022-04-28T10:58:11+02:00,2022-04-29T01:58:11+02:00
533,Nunc rhoncus dui vel sem.,24,2022-03-28T16:07:02+02:00,2022-03-28T16:07:02+02:00
534,Vestibulum rutrum rutrum neque. Aenean auctor gravida sem. Praesent id massa id nisl venenatis lacinia.,90,2022-07-01T18:14:02+02:00,2022-07-02T01:14:02+02:00
535,In hac habitasse platea dictumst.,66,2022-12-22T00:02:22+01:00,2022-12-22T10:02:22+01:00
536,Morbi porttitor lorem id ligula. Suspendisse ornare consequat lectus.,155,2022-03-13T02:12:28+01:00,2022-03-13T17:12:28+01:00
537,Integer ac neque.,193,2022-02-14T21:39:42+01:00,2022-02-15T18:39:42+01:00
538,"Praesent lectus. Vestibulum quam sapien, varius ut, blandit non, interdum in, ante. Vestibulum ante ipsum primis in faucibus orci luctus et ultrices posuere cubilia Curae; Duis faucibus accumsan odio.",161,2022-06-25T06:22:24+02:00,2022-06-26T01:22:24+02:00
539,Morbi non quam nec dui luctus rutrum. Nulla tellus. In sagittis dui vel nisl.,195,2021-07-29T20:24:15+02:00,2021-07-30T20:24:15+02:00
540,Pellentesque eget nunc.,21,2022-09-02T03:31:24+02:00,2022-09-02T18:31:24+02:00
541,Suspendisse potenti. Cras in purus eu magna vulputate luctus.,20,2021-11-01T13:35:45+01:00,2021-11-01T20:35:45+01:00
542,Nullam varius. Nulla facilisi.,41,2022-11-06T22:57:04+01:00,2022-11-07T13:57:04+01:00
543,Maecenas pulvinar lobortis est. Phasellus sit amet erat.,135,2022-03-22T17:57:47+01:00,2022-03-23T08:57:47+01:00
544,"Nam nulla. Integer pede justo, lacinia eget, tincidunt eget, tempus vel, pede. Morbi porttitor lorem id ligula.",164,2022-01-21T23:15:32+01:00,2022-01-22T22:15:32+01:00
545,Etiam faucibus cursus urna. Ut tellus. Nulla ut erat id mauris vulputate elementum.,14,2021-07-28T22:44:53+02:00,2021-07-29T09:44:53+02:00
546,Aliquam erat volutpat. In congue.,176,2022-08-02T19:48:44+02:00,2022-08-03T16:48:44+02:00
547,"Morbi quis tortor id nulla ultrices aliquet. Maecenas leo odio, condimentum id, luctus nec, molestie sed, justo.",26,2022-01-01T14:25:13+01:00,2022-01-02T10:25:13+01:00
548,Nunc purus. Phasellus in felis. Donec semper sapien a libero.,198,2022-07-14T01:47:41+02:00,2022-07-14T23:47:41+02:00
549,Maecenas tincidunt lacus at velit.,124,2022-06-25T05:21:45+02:00,2022-06-25T05:21:45+02:00
550,Proin risus.,84,2022-10-27T19:57:48+02:00,2022-10-28T01:57:48+02:00
551,Mauris sit amet eros.,11,2021-09-12T03:00:50+02:00,2021-09-13T03:00:50+02:00
