id,content,creator_id,date_created,date_modified
190,In hac habitasse platea dictumst.,59,2021-08-31T17:45:12+02:00,2021-09-01T01:45:12+02:00
191,Nulla mollis molestie lorem. Quisque ut erat. Curabitur gravida nisi at nibh.,175,2022-12-04T15:31:48+01:00,2022-12-05T00:31:48+01:00
192,"In tempor, turpis nec euismod scelerisque, quam turpis adipiscing lorem, vitae mattis nibh ligula nec sem.",42,2021-11-23T17:24:54+01:00,2021-11-23T20:24:54+01:00
193,Quisque ut erat. Curabitur gravida nisi at nibh. In hac habitasse platea dictumst.,85,2022-08-20T00:47:26+02:00,2022-08-20T09:47:26+02:00
194,Sed ante.,7,2023-02-12T07:15:09+01:00,2023-02-12T23:15:09+01:00
195,Aliquam quis turpis eget elit sodales scelerisque.,138,2021-09-13T22:06:59+02:00,2021-09-14T16:06:59+02:00
196,Fusce consequat. Nulla nisl. Nunc nisl.,89,2022-02-10T05:00:17+01:00,2022-02-10T15:00:17+01:00
197,Suspendisse potenti. Nullam porttitor lacus at turpis.,140,2022-02-28T09:15:45+01:00,2022-02-28T16:15:45+01:00
198,Nulla ut erat id mauris vulputate elementum. Nullam varius. Nulla facilisi.,83,2021-08-19T09:20:24+02:00,2021-08-20T07:20:24+02:00
199,Sed vel enim sit amet nunc viverra dapibus.,127,2022-12-12T21:26:01+01:00,2022-12-13T03:26:01+01:00
200,"Morbi sem mauris, laoreet ut, rhoncus aliquet, pulvinar sed, nisl.",124,2021-12-20T11:59:57+01:00,2021-12-21T04:59:57+01:00
201,"Mauris enim leo, rhoncus sed, vestibulum sit amet, cursus id, turpis. Integer aliquet, massa id lobortis convallis, tortor risus dapibus augue, vel accumsan tellus nisi eu orci.",84,2022-09-28T23:42:44+02:00,2022-09-28T23:42:44+02:00
202,Vestibulum rutrum rutrum neque. Aenean auctor gravida sem.,184,2022-04-18T11:32:17+02:00,2022-04-19T07:32:17+02:00
203,"Vivamus metus arcu, adipiscing molestie, hendrerit at, vulputate vitae, nisl. Aenean lectus. Pellentesque eget nunc.",188,2021-11-21T16:03:22+01:00,2021-11-21T16:03:22+01:00
204,"Vivamus vestibulum sagittis sapien. Cum sociis natoque penatibus et magnis dis parturient montes, nascetur ridiculus mus.",143,2022-07-22T12:06:44+02:00,2022-07-23T07:06:44+02:00
205,"Donec odio justo, sollicitudin ut, suscipit a, feugiat et, eros. Vestibulum ac est lacinia nisi venenatis tristique.",7,2023-01-01T07:12:07+01:00,2023-01-02T04:12:07+01:00
206,"Cum sociis natoque penatibus et magnis dis parturient montes, nascetur ridiculus mus. Vivamus vestibulum sagittis sapien. Cum sociis natoque penatibus et magnis dis parturient montes, nascetur ridiculus mus.",133,2022-08-15T03:10:48+02:00,2022-08-15T05:10:48+02:00
207,"Vestibulum quam sapien, varius ut, blandit non, interdum in, ante. Vestibulum ante ipsum primis in faucibus orci luctus et ultrices posuere cubilia Curae; Duis faucibus accumsan odio.",95,2021-10-25T07:30:41+02:00,2021-10-25T18:30:41+02:00
208,Maecenas tincidunt lacus at velit.,200,2021-11-03T16:57:09+01:00,2021-11-04T09:57:09+01:00
209,"Lorem ipsum dolor sit amet, consectetuer adipiscing elit.",98,2022-09-27T14:59:03+02:00,2022-09-28T14:59:03+02:00
210,Nullam porttitor lacus at turpis. Donec posuere metus vitae ipsum. Aliquam non mauris.,79,2022-02-26T13:19:24+01:00,2022-02-26T17:19:24+01:00
211,Mauris ullamcorper purus sit amet nulla.,4,2022-10-07T21:11:27+02:00,2022-10-08T12:11:27+02:00
212,"Cum sociis natoque penatibus et magnis dis parturient montes, nascetur ridiculus mus.",8,2022-06-03T00:25:55+02:00,2022-06-03T13:25:55+02:00
213,"Quisque erat eros, viverra eget, congue eget, semper rutrum, nulla. Nunc purus. Phasellus in felis.",81,2021-07-16T21:54:41+02:00,2021-07-17T04:54:41+02:00
214,"Morbi sem mauris, laoreet ut, rhoncus aliquet, pulvinar sed, nisl.",132,2022-11-07T10:14:20+01:00,2022-11-08T00:14:20+01:00
215,Vestibulum sed magna at nunc commodo placerat. Praesent blandit. Nam nulla.,61,2022-05-19T20:40:37+02:00,2022-05-20T15:40:37+02:00
216,Etiam pretium iaculis justo. In hac habitasse platea dictumst.,22,2022-03-12T13:40:16+01:00,2022-03-13T02:40:16+01:00
217,Nulla tellus.,57,2022-04-17T12:26:04+02:00,2022-04-18T03:26:04+02:00
218,In quis justo. Maecenas rhoncus aliquam lacus.,101,2022-11-22T12:22:29+01:00,2022-11-23T07:22:29+01:00
219,"Pellentesque viverra pede ac diam. Cras pellentesque volutpat dui. Maecenas tristique, est et tempus semper, est quam pharetra magna, ac consequat metus sapien ut nunc.",24,2021-12-02T18:02:33+01:00,2021-12-03T10:02:33+01:00
220,"Vestibulum ante ipsum primis in faucibus orci luctus et ultrices posuere cubilia Curae; Donec pharetra, magna vestibulum aliquet ultrices, erat tortor sollicitudin mi, sit amet lobortis sapien sapien non mi. Integer ac neque.",167,2022-04-01T13:04:22+02:00,2022-04-01T18:04:22+02:00
221,Praesent blandit.,128,2022-11-25T05:02:00+01:00,2022-11-25T18:02:00+01:00
222,"Fusce lacus purus, aliquet at, feugiat non, pretium quis, lectus. Suspendisse potenti.",102,2022-05-19T15:21:27+02:00,2022-05-20T11:21:27+02:00
223,Duis mattis egestas metus. Aenean fermentum. Donec ut mauris eget massa tempor convallis.,192,2022-09-10T02:47:12+02:00,2022-09-10T08:47:12+02:00
224,Maecenas tincidunt lacus at velit. Vivamus vel nulla eget eros elementum pellentesque. Quisque porta volutpat erat.,46,2022-10-03T05:26:23+02:00,2022-10-03T16:26:23+02:00
225,Vivamus tortor. Duis mattis egestas metus.,3,2021-11-23T21:29:41+01:00,2021-11-24T06:29:41+01:00
226,"In hac habitasse platea dictumst. Aliquam augue quam, sollicitudin vitae, consectetuer eget, rutrum at, lorem. Integer tincidunt ante vel ipsum.",111,2021-12-21T04:28:31+01:00,2021-12-22T04:28:31+01:00
227,Integer tincidunt ante vel ipsum. Praesent blandit lacinia erat.,97,2022-03-05T06:49:20+01:00,2022-03-05T15:49:20+01:00
228,"Proin leo odio, porttitor id, consequat in, consequat ut, nulla. Sed accumsan felis. Ut at dolor quis odio consequat varius.",137,2022-07-26T01:27:45+02:00,2022-07-26T12:27:45+02:00
229,"Proin leo odio, porttitor id, consequat in, consequat ut, nulla. Sed accumsan felis.",45,2023-04-12T22:05:09+02:00,2023-04-13T17:05:09+02:00
230,Curabitur in libero ut massa volutpat convallis.,196,2022-07-05T15:29:54+02:00,2022-07-06T07:29:54+02:00
231,Nullam sit amet turpis elementum ligula vehicula consequat.,158,2022-05-05T20:54:19+02:00,2022-05-06T17:54:19+02:00
232,Vestibulum rutrum rutrum neque.,29,2021-09-25T12:44:44+02:00,2021-09-26T04:44:44+02:00
233,Ut at dolor quis odio consequat varius. Integer ac leo. Pellentesque ultrices mattis odio.,11,2022-02-28T06:10:35+01:00,2022-02-28T13:10:35+01:00
234,Sed vel enim sit amet nunc viverra dapibus. Nulla suscipit ligula in lacus. Curabitur at ipsum ac tellus semper interdum.,147,2022-06-27T04:42:58+02:00,2022-06-27T19:42:58+02:00
235,Maecenas pulvinar lobortis est. Phasellus sit amet erat. Nulla tempus.,72,2022-02-28T10:01:33+01:00,2022-02-28T21:01:33+01:00
236,Nullam porttitor lacus at turpis. Donec posuere metus vitae ipsum.,136,2022-03-30T02:06:57+02:00,2022-03-30T11:06:57+02:00
237,Integer tincidunt ante vel ipsum. Praesent blandit lacinia erat. Vestibulum sed magna at nunc commodo placerat.,92,2021-05-23T06:03:53+02:00,2021-05-23T15:03:53+02:00
238,Nam tristique tortor eu pede.,106,2021-09-20T05:46:39+02:00,2021-09-20T06:46:39+02:00
239,Morbi quis tortor id nulla ultrices aliquet.,160,2022-11-07T12:44:57+01:00,2022-11-07T23:44:57+01:00
240,Proin at turpis a pede posuere nonummy. Integer non velit.,21,2022-02-06T16:06:31+01:00,2022-02-07T06:06:31+01:00
241,Donec semper sapien a libero. Nam dui.,12,2022-02-06T20:34:19+01:00,2022-02-07T16:34:19+01:00
242,"Nullam orci pede, venenatis non, sodales sed, tincidunt eu, felis. Fusce posuere felis sed lacus.",123,2022-10-03T12:50:35+02:00,2022-10-04T02:50:35+02:00
243,Duis at velit eu est congue elementum.,197,2022-05-26T07:28:34+02:00,2022-05-26T12:28:34+02:00
244,Maecenas rhoncus aliquam lacus.,25,2022-08-28T15:45:10+02:00,2022-08-28T19:45:10+02:00
245,Aliquam quis turpis eget elit sodales scelerisque. Mauris sit amet eros. Suspendisse accumsan tortor quis turpis.,174,2022-09-08T19:41:05+02:00,2022-09-09T15:41:05+02:00
246,"Morbi porttitor lorem id ligula. Suspendisse ornare consequat lectus. In est risus, auctor sed, tristique in, tempus sit amet, sem.",178,2022-11-27T09:36:35+01:00,2022-11-27T10:36:35+01:00
247,"Quisque erat eros, viverra eget, congue eget, semper rutrum, nulla. Nunc purus.",91,2021-12-11T09:46:47+01:00,2021-12-11T17:46:47+01:00
248,In hac habitasse platea dictumst.,125,2022-10-12T19:16:14+02:00,2022-10-13T02:16:14+02:00
249,Aliquam non mauris. Morbi non lectus. Aliquam sit amet diam in magna bibendum imperdiet.,107,2021-06-26T00:36:23+02:00,2021-06-26T23:36:23+02:00
250,Mauris sit amet eros.,43,2022-03-08T04:25:11+01:00,2022-03-08T06:25:11+01:00
251,Maecenas rhoncus aliquam lacus. Morbi quis tortor id nulla ultrices aliquet.,137,2022-08-26T19:06:31+02:00,2022-08-27T07:06:31+02:00
252,Pellentesque ultrices mattis odio.,46,2022-04-24T15:09:43+02:00,2022-04-24T17:09:43+02:00
253,Ut tellus. Nulla ut erat id mauris vulputate elementum. Nullam varius.,134,2021-09-11T10:08:14+02:00,2021-09-12T10:08:14+02:00
254,In hac habitasse platea dictumst.,56,2022-03-23T12:01:10+01:00,2022-03-24T02:01:10+01:00
255,"Vivamus metus arcu, adipiscing molestie, hendrerit at, vulputate vitae, nisl. Aenean lectus. Pellentesque eget nunc.",20,2022-06-06T18:40:24+02:00,2022-06-06T20:40:24+02:00
256,Fusce consequat.,145,2021-10-19T09:35:25+02:00,2021-10-19T10:35:25+02:00
257,"Cum sociis natoque penatibus et magnis dis parturient montes, nascetur ridiculus mus. Etiam vel augue. Vestibulum rutrum rutrum neque.",117,2021-11-09T23:27:55+01:00,2021-11-10T11:27:55+01:00
258,In congue. Etiam justo. Etiam pretium iaculis justo.,35,2022-06-28T01:11:58+02:00,2022-06-28T07:11:58+02:00
259,Morbi non lectus. Aliquam sit amet diam in magna bibendum imperdiet.,24,2021-12-09T04:48:15+01:00,2021-12-09T21:48:15+01:00
260,Fusce consequat.,50,2021-11-26T07:55:35+01:00,2021-11-26T19:55:35+01:00
261,"Nunc nisl. Duis bibendum, felis sed interdum venenatis, turpis enim blandit mi, in porttitor pede justo eu massa. Donec dapibus.",85,2022-09-08T16:40:32+02:00,2022-09-09T15:40:32+02:00
262,Phasellus id sapien in sapien iaculis congue.,89,2022-02-18T12:28:07+01:00,2022-02-18T22:28:07+01:00
263,Nulla suscipit ligula in lacus. Curabitur at ipsum ac tellus semper interdum.,61,2021-06-18T00:04:12+02:00,2021-06-18T06:04:12+02:00
264,"Donec ut mauris eget massa tempor convallis. Nulla neque libero, convallis eget, eleifend luctus, ultricies eu, nibh. Quisque id justo sit amet sapien dignissim vestibulum.",142,2022-01-30T07:08:41+01:00,2022-01-30T19:08:41+01:00
265,"Mauris ullamcorper purus sit amet nulla. Quisque arcu libero, rutrum ac, lobortis vel, dapibus at, diam. Nam tristique tortor eu pede.",70,2023-01-06T03:32:43+01:00,2023-01-06T03:32:43+01:00
266,Morbi quis tortor id nulla ultrices aliquet.,190,2022-09-05T05:43:11+02:00,2022-09-05T07:43:11+02:00
267,Maecenas rhoncus aliquam lacus. Morbi quis tortor id nulla ultrices aliquet.,2,2021-12-21T17:26:23+01:00,2021-12-21T19:26:23+01:00
268,"Cum sociis natoque penatibus et magnis dis parturient montes, nascetur ridiculus mus.",53,2022-11-22T23:00:25+01:00,2022-11-23T08:00:25+01:00
269,Nulla suscipit ligula in lacus. Curabitur at ipsum ac tellus semper interdum. Mauris ullamcorper purus sit amet nulla.,31,2021-08-09T22:38:15+02:00,2021-08-10T15:38:15+02:00
270,Fusce consequat. Nulla nisl.,68,2022-01-01T12:02:17+01:00,2022-01-01T14:02:17+01:00
271,"Nam ultrices, libero non mattis pulvinar, nulla pede ullamcorper augue, a suscipit nulla elit ac nulla.",60,2022-07-14T17:56:44+02:00,2022-07-15T06:56:44+02:00
272,Etiam justo.,171,2021-11-09T07:37:28+01:00,2021-11-09T10:37:28+01:00
273,Aliquam sit amet diam in magna bibendum imperdiet.,54,2022-05-25T23:49:19+02:00,2022-05-26T12:49:19+02:00
274,Donec semper sapien a libero. Nam dui.,156,2022-10-06T02:27:01+02:00,2022-10-06T15:27:01+02:00
275,"Cras mi pede, malesuada in, imperdiet et, commodo vulputate, justo. In blandit ultrices enim.",3,2022-08-13T21:45:45+02:00,2022-08-14T00:45:45+02:00
276,"Vestibulum ante ipsum primis in faucibus orci luctus et ultrices posuere cubilia Curae; Nulla dapibus dolor vel est. Donec odio justo, sollicitudin ut, suscipit a, feugiat et, eros.",118,2022-11-20T07:05:24+01:00,2022-11-20T17:05:24+01:00
277,Vivamus in felis eu sapien cursus vestibulum. Proin eu mi. Nulla ac enim.,115,2022-05-22T11:08:59+02:00,2022-05-22T14:08:59+02:00
278,Duis mattis egestas metus. Aenean fermentum. Donec ut mauris eget massa tempor convallis.,63,2021-09-05T07:22:46+02:00,2021-09-05T18:22:46+02:00
279,Donec dapibus. Duis at velit eu est congue elementum.,175,2022-07-27T18:44:38+02:00,2022-07-28T00:44:38+02:00
280,"Nunc nisl. Duis bibendum, felis sed interdum venenatis, turpis enim blandit mi, in porttitor pede justo eu massa. Donec dapibus.",74,2022-03-19T19:45:03+01:00,2022-03-20T15:45:03+01:00
281,Vivamus vel nulla eget eros elementum pellentesque.,66,2022-04-14T09:31:58+02:00,2022-04-14T17:31:58+02:00
282,"Fusce congue, diam id ornare imperdiet, sapien urna pretium nisl, ut volutpat sapien arcu sed augue. Aliquam erat volutpat. In congue.",181,2022-03-10T22:22:04+01:00,2022-03-11T03:22:04+01:00
283,Cras in purus eu magna vulputate luctus.,96,2022-06-03T08:56:02+02:00,2022-06-03T08:56:02+02:00
284,Suspendisse potenti.,197,2022-01-19T14:17:23+01:00,2022-01-20T02:17:23+01:00
285,"Mauris enim leo, rhoncus sed, vestibulum sit amet, cursus id, turpis. Integer aliquet, massa id lobortis convallis, tortor risus dapibus augue, vel accumsan tellus nisi eu orci. Mauris lacinia sapien quis libero.",191,2022-12-30T05:00:40+01:00,2022-12-30T23:00:40+01:00
286,Morbi non lectus. Aliquam sit amet diam in magna bibendum imperdiet.,159,2021-09-05T15:34:06+02:00,2021-09-06T14:34:06+02:00
287,Morbi a ipsum. Integer a nibh. In quis justo.,131,2022-06-08T11:17:59+02:00,2022-06-09T08:17:59+02:00
288,"Quisque porta volutpat erat. Quisque erat eros, viverra eget, congue eget, semper rutrum, nulla. Nunc purus.",16,2022-05-24T00:36:52+02:00,2022-05-24T14:36:52+02:00
289,"Duis ac nibh. Fusce lacus purus, aliquet at, feugiat non, pretium quis, lectus.",195,2022-02-05T16:12:51+01:00,2022-02-06T02:12:51+01:00
290,Phasellus id sapien in sapien iaculis congue.,166,2023-04-17T00:50:16+02:00,2023-04-17T07:50:16+02:00
291,Donec posuere metus vitae ipsum. Aliquam non mauris. Morbi non lectus.,193,2022-07-20T02:23:19+02:00,2022-07-20T10:23:19+02:00
292,"Nam dui. Proin leo odio, porttitor id, consequat in, consequat ut, nulla.",87,2022-01-27T09:36:16+01:00,2022-01-27T19:36:16+01:00
293,"Aliquam augue quam, sollicitudin vitae, consectetuer eget, rutrum at, lorem. Integer tincidunt ante vel ipsum. Praesent blandit lacinia erat.",104,2022-02-01T01:38:39+01:00,2022-02-01T14:38:39+01:00
294,Aenean fermentum. Donec ut mauris eget massa tempor convallis.,199,2022-12-28T21:40:06+01:00,2022-12-29T09:40:06+01:00
295,"In hac habitasse platea dictumst. Morbi vestibulum, velit id pretium iaculis, diam erat fermentum justo, nec condimentum neque sapien placerat ante. Nulla justo.",140,2021-09-28T21:26:43+02:00,2021-09-29T12:26:43+02:00
296,In eleifend quam a odio. In hac habitasse platea dictumst. Maecenas ut massa quis augue luctus tincidunt.,120,2023-01-03T00:02:53+01:00,2023-01-03T16:02:53+01:00
297,Aenean auctor gravida sem.,78,2022-02-03T23:33:24+01:00,2022-02-04T14:33:24+01:00
298,"Quisque id justo sit amet sapien dignissim vestibulum. Vestibulum ante ipsum primis in faucibus orci luctus et ultrices posuere cubilia Curae; Nulla dapibus dolor vel est. Donec odio justo, sollicitudin ut, suscipit a, feugiat et, eros.",62,2022-07-21T14:40:04+02:00,2022-07-22T13:40:04+02:00
299,Aliquam erat volutpat. In congue. Etiam justo.,200,2022-01-06T23:06:23+01:00,2022-01-07T19:06:23+01:00
300,Nullam molestie nibh in lectus.,55,2021-09-09T11:05:28+02:00,2021-09-09T11:05:28+02:00
301,Nulla suscipit ligula in lacus. Curabitur at ipsum ac tellus semper interdum. Mauris ullamcorper purus sit amet nulla.,99,2023-01-18T08:38:21+01:00,2023-01-18T11:38:21+01:00
302,Aenean lectus. Pellentesque eget nunc.,169,2022-06-19T16:08:19+02:00,2022-06-20T14:08:19+02:00
303,Aliquam non mauris. Morbi non lectus. Aliquam sit amet diam in magna bibendum imperdiet.,43,2022-04-29T10:01:48+02:00,2022-04-30T08:01:48+02:00
304,"Vivamus vestibulum sagittis sapien. Cum sociis natoque penatibus et magnis dis parturient montes, nascetur ridiculus mus. Etiam vel augue.",44,2021-09-07T22:02:10+02:00,2021-09-08T21:02:10+02:00
305,"Curabitur gravida nisi at nibh. In hac habitasse platea dictumst. Aliquam augue quam, sollicitudin vitae, consectetuer eget, rutrum at, lorem.",52,2022-03-05T17:33:50+01:00,2022-03-05T22:33:50+01:00
306,"Duis at velit eu est congue elementum. In hac habitasse platea dictumst. Morbi vestibulum, velit id pretium iaculis, diam erat fermentum justo, nec condimentum neque sapien placerat ante.",106,2021-09-09T08:24:22+02:00,2021-09-10T01:24:22+02:00
307,Nunc purus. Phasellus in felis. Donec semper sapien a libero.,19,2021-10-12T10:13:54+02:00,2021-10-12T12:13:54+02:00
308,Nullam sit amet turpis elementum ligula vehicula consequat. Morbi a ipsum. Integer a nibh.,74,2021-09-08T11:30:28+02:00,2021-09-09T04:30:28+02:00
309,"Morbi odio odio, elementum eu, interdum eu, tincidunt in, leo. Maecenas pulvinar lobortis est.",79,2022-02-25T11:12:39+01:00,2022-02-26T02:12:39+01:00
310,"Proin at turpis a pede posuere nonummy. Integer non velit. Donec diam neque, vestibulum eget, vulputate ut, ultrices vel, augue.",117,2022-05-23T05:48:23+02:00,2022-05-23T17:48:23+02:00
311,In hac habitasse platea dictumst. Maecenas ut massa quis augue luctus tincidunt. Nulla mollis molestie lorem.,65,2021-09-19T22:04:58+02:00,2021-09-20T18:04:58+02:00
312,"Donec ut mauris eget massa tempor convallis. Nulla neque libero, convallis eget, eleifend luctus, ultricies eu, nibh. Quisque id justo sit amet sapien dignissim vestibulum.",147,2021-09-11T06:40:58+02:00,2021-09-12T00:40:58+02:00
313,"Quisque erat eros, viverra eget, congue eget, semper rutrum, nulla. Nunc purus.",199,2022-10-01T06:06:09+02:00,2022-10-01T22:06:09+02:00
314,"Vestibulum ac est lacinia nisi venenatis tristique. Fusce congue, diam id ornare imperdiet, sapien urna pretium nisl, ut volutpat sapien arcu sed augue.",177,2022-05-22T08:02:54+02:00,2022-05-23T01:02:54+02:00
315,Sed vel enim sit amet nunc viverra dapibus. Nulla suscipit ligula in lacus.,179,2022-03-17T14:30:38+01:00,2022-03-17T23:30:38+01:00
316,Mauris lacinia sapien quis libero. Nullam sit amet turpis elementum ligula vehicula consequat. Morbi a ipsum.,80,2022-12-11T09:26:04+01:00,2022-12-11T14:26:04+01:00
317,Vestibulum sed magna at nunc commodo placerat. Praesent blandit.,5,2022-07-30T10:02:03+02:00,2022-07-30T11:02:03+02:00
318,Donec ut mauris eget massa tempor convallis.,178,2023-03-30T22:23:32+02:00,2023-03-31T22:23:32+02:00
319,Duis mattis egestas metus.,8,2023-02-06T06:42:42+01:00,2023-02-06T11:42:42+01:00
320,"Nam dui. Proin leo odio, porttitor id, consequat in, consequat ut, nulla.",94,2022-02-24T18:03:33+01:00,2022-02-24T21:03:33+01:00
321,"Nam nulla. Integer pede justo, lacinia eget, tincidunt eget, tempus vel, pede. Morbi porttitor lorem id ligula.",182,2022-02-07T06:08:35+01:00,2022-02-07T23:08:35+01:00
322,Aliquam erat volutpat.,103,2021-06-03T08:14:39+02:00,2021-06-04T06:14:39+02:00
323,Nulla suscipit ligula in lacus.,12,2022-08-20T21:33:10+02:00,2022-08-21T14:33:10+02:00
324,"Maecenas rhoncus aliquam lacus. Morbi quis tortor id nulla ultrices aliquet. Maecenas leo odio, condimentum id, luctus nec, molestie sed, justo.",170,2022-05-09T13:40:53+02:00,2022-05-09T20:40:53+02:00
325,"Donec ut mauris eget massa tempor convallis. Nulla neque libero, convallis eget, eleifend luctus, ultricies eu, nibh.",187,2021-12-25T04:02:13+01:00,2021-12-25T15:02:13+01:00
326,Nulla facilisi.,188,2022-07-03T18:21:42+02:00,2022-07-04T03:21:42+02:00
327,Quisque id justo sit amet sapien dignissim vestibulum.,18,2022-09-10T14:16:36+02:00,2022-09-11T08:16:36+02:00
328,Nam dui.,102,2022-04-11T11:28:10+02:00,2022-04-12T11:28:10+02:00
329,Duis bibendum. Morbi non quam nec dui luctus rutrum. Nulla tellus.,141,2023-03-15T17:52:09+01:00,2023-03-15T22:52:09+01:00
330,"Vivamus metus arcu, adipiscing molestie, hendrerit at, vulputate vitae, nisl. Aenean lectus.",77,2022-04-27T01:51:42+02:00,2022-04-27T22:51:42+02:00
331,Mauris lacinia sapien quis libero.,92,2022-01-03T20:09:04+01:00,2022-01-04T16:09:04+01:00
332,"Nam congue, risus semper porta volutpat, quam pede lobortis ligula, sit amet eleifend pede libero quis orci. Nullam molestie nibh in lectus. Pellentesque at nulla.",72,2021-07-12T20:17:25+02:00,2021-07-13T14:17:25+02:00
333,"Morbi vestibulum, velit id pretium iaculis, diam erat fermentum justo, nec condimentum neque sapien placerat ante. Nulla justo. Aliquam quis turpis eget elit sodales scelerisque.",51,2022-02-14T09:32:38+01:00,2022-02-14T17:32:38+01:00
334,Morbi quis tortor id nulla ultrices aliquet.,11,2022-03-11T12:27:45+01:00,2022-03-12T02:27:45+01:00
335,Praesent id massa id nisl venenatis lacinia.,149,2021-09-30T15:53:13+02:00,2021-09-30T15:53:13+02:00
336,Etiam pretium iaculis justo. In hac habitasse platea dictumst.,78,2022-05-02T22:12:41+02:00,2022-05-03T11:12:41+02:00
337,"Fusce posuere felis sed lacus. Morbi sem mauris, laoreet ut, rhoncus aliquet, pulvinar sed, nisl. Nunc rhoncus dui vel sem.",104,2022-06-15T09:47:42+02:00,2022-06-16T01:47:42+02:00
338,"Nam dui. Proin leo odio, porttitor id, consequat in, consequat ut, nulla.",131,2022-08-25T05:04:51+02:00,2022-08-26T03:04:51+02:00
339,"In blandit ultrices enim. Lorem ipsum dolor sit amet, consectetuer adipiscing elit. Proin interdum mauris non ligula pellentesque ultrices.",32,2022-12-27T03:00:23+01:00,2022-12-27T12:00:23+01:00
340,"Morbi odio odio, elementum eu, interdum eu, tincidunt in, leo. Maecenas pulvinar lobortis est.",175,2022-12-20T17:34:49+01:00,2022-12-21T02:34:49+01:00
341,"Quisque porta volutpat erat. Quisque erat eros, viverra eget, congue eget, semper rutrum, nulla. Nunc purus.",155,2021-10-10T01:25:09+02:00,2021-10-10T15:25:09+02:00
342,"Proin leo odio, porttitor id, consequat in, consequat ut, nulla. Sed accumsan felis. Ut at dolor quis odio consequat varius.",173,2022-02-26T14:54:26+01:00,2022-02-26T16:54:26+01:00
343,Morbi porttitor lorem id ligula.,116,2021-12-14T07:39:43+01:00,2021-12-14T13:39:43+01:00
344,Duis mattis egestas metus. Aenean fermentum. Donec ut mauris eget massa tempor convallis.,100,2022-03-28T05:58:27+02:00,2022-03-28T11:58:27+02:00
345,Nullam sit amet turpis elementum ligula vehicula consequat. Morbi a ipsum. Integer a nibh.,121,2021-10-08T16:56:21+02:00,2021-10-08T21:56:21+02:00
346,"Integer pede justo, lacinia eget, tincidunt eget, tempus vel, pede. Morbi porttitor lorem id ligula.",89,2022-02-19T20:34:22+01:00,2022-02-20T20:34:22+01:00
347,"Maecenas tristique, est et tempus semper, est quam pharetra magna, ac consequat metus sapien ut nunc.",152,2022-01-24T00:02:59+01:00,2022-01-24T16:02:59+01:00
348,Morbi a ipsum.,165,2022-02-22T16:49:26+01:00,2022-02-23T16:49:26+01:00
349,Nunc purus. Phasellus in felis.,95,2022-04-20T22:11:06+02:00,2022-04-20T23:11:06+02:00
350,"Fusce lacus purus, aliquet at, feugiat non, pretium quis, lectus. Suspendisse potenti. In eleifend quam a odio.",176,2022-07-18T06:46:22+02:00,2022-07-18T21:46:22+02:00
351,"Fusce lacus purus, aliquet at, feugiat non, pretium quis, lectus.",85,2022-06-12T13:43:40+02:00,2022-06-12T19:43:40+02:00
352,Donec semper sapien a libero. Nam dui.,104,2022-07-29T08:02:07+02:00,2022-07-30T01:02:07+02:00
353,"Phasellus id sapien in sapien iaculis congue. Vivamus metus arcu, adipiscing molestie, hendrerit at, vulputate vitae, nisl. Aenean lectus.",35,2022-01-29T19:41:49+01:00,2022-01-30T10:41:49+01:00
354,"Nam nulla. Integer pede justo, lacinia eget, tincidunt eget, tempus vel, pede.",75,2022-08-25T09:56:21+02:00,2022-08-25T15:56:21+02:00
355,Aliquam quis turpis eget elit sodales scelerisque.,190,2022-10-14T11:59:58+02:00,2022-10-15T07:59:58+02:00
356,Maecenas tincidunt lacus at velit. Vivamus vel nulla eget eros elementum pellentesque.,147,2022-03-06T07:37:51+01:00,2022-03-06T07:37:51+01:00
357,Maecenas pulvinar lobortis est. Phasellus sit amet erat. Nulla tempus.,194,2022-07-25T08:37:23+02:00,2022-07-25T08:37:23+02:00
358,"Fusce posuere felis sed lacus. Morbi sem mauris, laoreet ut, rhoncus aliquet, pulvinar sed, nisl.",83,2022-01-13T16:30:53+01:00,2022-01-13T16:30:53+01:00
359,Nulla nisl.,4,2022-09-29T08:27:50+02:00,2022-09-29T23:27:50+02:00
360,"Donec diam neque, vestibulum eget, vulputate ut, ultrices vel, augue.",197,2022-09-29T01:59:28+02:00,2022-09-29T09:59:28+02:00
361,Phasellus sit amet erat. Nulla tempus.,77,2022-08-14T14:25:31+02:00,2022-08-15T14:25:31+02:00
362,Ut tellus. Nulla ut erat id mauris vulputate elementum. Nullam varius.,119,2021-12-10T03:53:47+01:00,2021-12-10T16:53:47+01:00
363,"In tempor, turpis nec euismod scelerisque, quam turpis adipiscing lorem, vitae mattis nibh ligula nec sem. Duis aliquam convallis nunc. Proin at turpis a pede posuere nonummy.",193,2021-11-29T20:10:49+01:00,2021-11-30T11:10:49+01:00
364,"Suspendisse ornare consequat lectus. In est risus, auctor sed, tristique in, tempus sit amet, sem.",174,2022-07-10T10:42:03+02:00,2022-07-10T16:42:03+02:00
365,Vivamus vel nulla eget eros elementum pellentesque. Quisque porta volutpat erat.,42,2022-05-26T21:21:58+02:00,2022-05-27T08:21:58+02:00
366,Maecenas rhoncus aliquam lacus. Morbi quis tortor id nulla ultrices aliquet.,165,2021-10-20T10:46:17+02:00,2021-10-21T08:46:17+02:00
367,Phasellus id sapien in sapien iaculis congue.,51,2021-08-10T07:37:31+02:00,2021-08-10T18:37:31+02:00
368,"Lorem ipsum dolor sit amet, consectetuer adipiscing elit.",67,2022-04-16T00:55:14+02:00,2022-04-16T14:55:14+02:00
369,Nunc purus.,183,2022-05-23T09:37:13+02:00,2022-05-24T04:37:13+02:00
370,"Curabitur at ipsum ac tellus semper interdum. Mauris ullamcorper purus sit amet nulla. Quisque arcu libero, rutrum ac, lobortis vel, dapibus at, diam.",175,2022-05-23T19:37:43+02:00,2022-05-24T11:37:43+02:00
