id,content,creator_id,date_created,date_modified
1,"Aliquam sit amet diam in magna bibendum imperdiet. Nullam orci pede, venenatis non, sodales sed, tincidunt eu, felis. Fusce posuere felis sed lacus.",101,2022-10-25T00:29:08+02:00,2022-10-25T10:29:08+02:00
2,In congue.,19,2022-08-16T11:44:53+02:00,2022-08-16T17:44:53+02:00
3,Etiam faucibus cursus urna.,57,2022-06-29T17:55:59+02:00,2022-06-29T21:55:59+02:00
4,Nullam porttitor lacus at turpis. Donec posuere metus vitae ipsum.,10,2022-02-04T10:57:34+01:00,2022-02-04T10:57:34+01:00
5,"Morbi sem mauris, laoreet ut, rhoncus aliquet, pulvinar sed, nisl. Nunc rhoncus dui vel sem. Sed sagittis.",143,2021-12-21T21:29:54+01:00,2021-12-22T16:29:54+01:00
6,Nulla tempus. Vivamus in felis eu sapien cursus vestibulum.,6,2022-02-05T09:19:13+01:00,2022-02-05T12:19:13+01:00
7,Duis mattis egestas metus. Aenean fermentum. Donec ut mauris eget massa tempor convallis.,121,2022-03-31T12:40:21+02:00,2022-04-01T09:40:21+02:00
8,In hac habitasse platea dictumst. Maecenas ut massa quis augue luctus tincidunt. Nulla mollis molestie lorem.,13,2022-07-23T05:56:29+02:00,2022-07-23T14:56:29+02:00
9,"Phasellus id sapien in sapien iaculis congue. Vivamus metus arcu, adipiscing molestie, hendrerit at, vulputate vitae, nisl. Aenean lectus.",100,2021-10-01T00:19:17+02:00,2021-10-01T17:19:17+02:00
10,Nullam varius. Nulla facilisi. Cras non velit nec nisi vulputate nonummy.,15,2022-04-03T19:07:23+02:00,2022-04-04T09:07:23+02:00
11,Nullam varius.,102,2022-06-21T19:00:32+02:00,2022-06-22T13:00:32+02:00
12,Curabitur in libero ut massa volutpat convallis.,125,2022-01-06T04:51:44+01:00,2022-01-06T22:51:44+01:00
13,Phasellus in felis. Donec semper sapien a libero. Nam dui.,109,2022-03-05T16:35:03+01:00,2022-03-05T19:35:03+01:00
14,Duis consequat dui nec nisi volutpat eleifend. Donec ut dolor. Morbi vel lectus in quam fringilla rhoncus.,183,2022-06-23T08:48:51+02:00,2022-06-23T10:48:51+02:00
15,Morbi quis tortor id nulla ultrices aliquet.,106,2022-04-01T02:51:06+02:00,2022-04-01T06:51:06+02:00
16,Ut at dolor quis odio consequat varius. Integer ac leo.,29,2022-01-17T23:43:03+01:00,2022-01-18T01:43:03+01:00
17,Mauris sit amet eros. Suspendisse accumsan tortor quis turpis.,124,2022-05-26T10:41:25+02:00,2022-05-26T20:41:25+02:00
18,Pellentesque viverra pede ac diam. Cras pellentesque volutpat dui.,171,2021-10-10T10:10:17+02:00,2021-10-11T08:10:17+02:00
19,"Proin leo odio, porttitor id, consequat in, consequat ut, nulla. Sed accumsan felis. Ut at dolor quis odio consequat varius.",136,2023-02-07T03:43:18+01:00,2023-02-07T15:43:18+01:00
20,Proin eu mi.,21,2022-02-02T00:08:47+01:00,2022-02-02T09:08:47+01:00
21,Curabitur gravida nisi at nibh.,5,2023-03-21T03:08:40+01:00,2023-03-21T19:08:40+01:00
22,In congue.,170,2023-04-15T16:20:16+02:00,2023-04-15T23:20:16+02:00
23,Nulla mollis molestie lorem.,118,2022-03-31T18:08:26+02:00,2022-04-01T11:08:26+02:00
24,Vivamus in felis eu sapien cursus vestibulum. Proin eu mi.,44,2021-09-10T22:56:20+02:00,2021-09-11T09:56:20+02:00
25,"Maecenas tristique, est et tempus semper, est quam pharetra magna, ac consequat metus sapien ut nunc. Vestibulum ante ipsum primis in faucibus orci luctus et ultrices posuere cubilia Curae; Mauris viverra diam vitae quam. Suspendisse potenti.",132,2022-07-26T15:02:39+02:00,2022-07-27T03:02:39+02:00
26,Morbi a ipsum. Integer a nibh.,156,2022-12-19T23:08:22+01:00,2022-12-20T16:08:22+01:00
27,"Donec vitae nisi. Nam ultrices, libero non mattis pulvinar, nulla pede ullamcorper augue, a suscipit nulla elit ac nulla. Sed vel enim sit amet nunc viverra dapibus.",28,2023-01-15T22:30:48+01:00,2023-01-16T13:30:48+01:00
28,Praesent blandit lacinia erat.,179,2021-06-14T19:02:05+02:00,2021-06-15T08:02:05+02:00
29,Phasellus sit amet erat.,84,2023-02-10T20:40:26+01:00,2023-02-11T15:40:26+01:00
30,"Duis bibendum, felis sed interdum venenatis, turpis enim blandit mi, in porttitor pede justo eu massa. Donec dapibus.",68,2021-12-17T02:24:24+01:00,2021-12-17T16:24:24+01:00
31,Nunc purus. Phasellus in felis. Donec semper sapien a libero.,117,2022-05-27T04:47:51+02:00,2022-05-27T05:47:51+02:00
32,Pellentesque at nulla. Suspendisse potenti.,31,2021-08-20T12:59:40+02:00,2021-08-21T01:59:40+02:00
33,"Lorem ipsum dolor sit amet, consectetuer adipiscing elit. Proin risus. Praesent lectus.",92,2021-11-17T01:23:10+01:00,2021-11-17T06:23:10+01:00
34,Aenean sit amet justo.,82,2021-09-09T16:44:47+02:00,2021-09-10T08:44:47+02:00
35,Nulla tempus. Vivamus in felis eu sapien cursus vestibulum.,72,2021-07-26T22:21:00+02:00,2021-07-27T15:21:00+02:00
36,Aenean lectus. Pellentesque eget nunc.,64,2022-09-02T13:54:03+02:00,2022-09-03T03:54:03+02:00
37,"Proin leo odio, porttitor id, consequat in, consequat ut, nulla.",20,2021-11-21T13:41:08+01:00,2021-11-21T17:41:08+01:00
38,In eleifend quam a odio. In hac habitasse platea dictumst. Maecenas ut massa quis augue luctus tincidunt.,97,2022-03-30T19:01:58+02:00,2022-03-30T20:01:58+02:00
39,Curabitur convallis.,127,2022-06-23T01:40:26+02:00,2022-06-23T11:40:26+02:00
40,Nulla ac enim.,189,2022-10-09T00:54:14+02:00,2022-10-09T21:54:14+02:00
41,"Vestibulum ac est lacinia nisi venenatis tristique. Fusce congue, diam id ornare imperdiet, sapien urna pretium nisl, ut volutpat sapien arcu sed augue.",137,2023-03-01T14:59:11+01:00,2023-03-01T17:59:11+01:00
42,Curabitur convallis. Duis consequat dui nec nisi volutpat eleifend.,135,2022-05-14T18:43:04+02:00,2022-05-15T15:43:04+02:00
43,Vivamus in felis eu sapien cursus vestibulum.,1,2021-11-16T15:35:42+01:00,2021-11-17T00:35:42+01:00
44,"Nam dui. Proin leo odio, porttitor id, consequat in, consequat ut, nulla. Sed accumsan felis.",162,2022-09-29T07:52:33+02:00,2022-09-29T20:52:33+02:00
45,"Morbi quis tortor id nulla ultrices aliquet. Maecenas leo odio, condimentum id, luctus nec, molestie sed, justo. Pellentesque viverra pede ac diam.",93,2022-06-14T23:47:25+02:00,2022-06-15T13:47:25+02:00
46,"Curabitur in libero ut massa volutpat convallis. Morbi odio odio, elementum eu, interdum eu, tincidunt in, leo.",25,2022-11-26T08:57:18+01:00,2022-11-26T17:57:18+01:00
47,Sed ante. Vivamus tortor.,107,2022-02-17T00:19:37+01:00,2022-02-17T15:19:37+01:00
48,Vestibulum rutrum rutrum neque. Aenean auctor gravida sem. Praesent id massa id nisl venenatis lacinia.,40,2023-01-17T12:53:16+01:00,2023-01-17T22:53:16+01:00
49,Integer non velit.,133,2022-12-28T14:23:01+01:00,2022-12-29T03:23:01+01:00
50,Duis aliquam convallis nunc. Proin at turpis a pede posuere nonummy.,168,2021-07-01T00:32:34+02:00,2021-07-01T07:32:34+02:00
51,Nulla justo. Aliquam quis turpis eget elit sodales scelerisque.,163,2023-01-31T02:45:16+01:00,2023-02-01T00:45:16+01:00
52,Proin at turpis a pede posuere nonummy. Integer non velit.,187,2021-11-26T23:27:30+01:00,2021-11-27T18:27:30+01:00
53,"Vestibulum ante ipsum primis in faucibus orci luctus et ultrices posuere cubilia Curae; Donec pharetra, magna vestibulum aliquet ultrices, erat tortor sollicitudin mi, sit amet lobortis sapien sapien non mi. Integer ac neque.",114,2021-10-21T02:53:09+02:00,2021-10-21T04:53:09+02:00
54,Donec dapibus.,44,2022-02-24T01:34:53+01:00,2022-02-24T23:34:53+01:00
55,"Donec ut mauris eget massa tempor convallis. Nulla neque libero, convallis eget, eleifend luctus, ultricies eu, nibh. Quisque id justo sit amet sapien dignissim vestibulum.",176,2021-09-23T18:12:20+02:00,2021-09-23T20:12:20+02:00
56,Duis consequat dui nec nisi volutpat eleifend.,118,2022-03-12T05:59:09+01:00,2022-03-12T10:59:09+01:00
57,Vestibulum rutrum rutrum neque. Aenean auctor gravida sem. Praesent id massa id nisl venenatis lacinia.,117,2021-12-10T01:48:29+01:00,2021-12-10T06:48:29+01:00
58,Donec posuere metus vitae ipsum. Aliquam non mauris. Morbi non lectus.,36,2023-02-23T23:35:26+01:00,2023-02-24T01:35:26+01:00
59,"Morbi sem mauris, laoreet ut, rhoncus aliquet, pulvinar sed, nisl.",99,2022-12-25T08:19:15+01:00,2022-12-25T17:19:15+01:00
60,Mauris lacinia sapien quis libero.,43,2022-05-18T00:37:16+02:00,2022-05-18T14:37:16+02:00
61,Phasellus sit amet erat. Nulla tempus.,199,2022-06-17T09:06:33+02:00,2022-06-17T18:06:33+02:00
62,Suspendisse potenti.,149,2022-02-05T12:09:36+01:00,2022-02-06T12:09:36+01:00
63,"In hac habitasse platea dictumst. Morbi vestibulum, velit id pretium iaculis, diam erat fermentum justo, nec condimentum neque sapien placerat ante. Nulla justo.",143,2022-07-01T08:31:10+02:00,2022-07-02T05:31:10+02:00
64,Curabitur gravida nisi at nibh. In hac habitasse platea dictumst.,110,2022-03-29T14:02:41+02:00,2022-03-30T10:02:41+02:00
65,Etiam pretium iaculis justo. In hac habitasse platea dictumst. Etiam faucibus cursus urna.,95,2022-03-08T11:59:44+01:00,2022-03-08T13:59:44+01:00
66,"Quisque arcu libero, rutrum ac, lobortis vel, dapibus at, diam. Nam tristique tortor eu pede.",47,2022-07-06T21:09:22+02:00,2022-07-07T01:09:22+02:00
67,Mauris lacinia sapien quis libero. Nullam sit amet turpis elementum ligula vehicula consequat. Morbi a ipsum.,90,2022-07-25T00:56:08+02:00,2022-07-25T05:56:08+02:00
68,Vestibulum rutrum rutrum neque. Aenean auctor gravida sem. Praesent id massa id nisl venenatis lacinia.,27,2023-01-28T21:52:37+01:00,2023-01-29T10:52:37+01:00
69,In quis justo. Maecenas rhoncus aliquam lacus.,124,2021-11-24T14:31:41+01:00,2021-11-25T01:31:41+01:00
70,In hac habitasse platea dictumst. Etiam faucibus cursus urna.,198,2022-07-08T13:08:30+02:00,2022-07-09T04:08:30+02:00
71,"Cum sociis natoque penatibus et magnis dis parturient montes, nascetur ridiculus mus.",174,2022-02-13T08:31:46+01:00,2022-02-14T02:31:46+01:00
72,Duis mattis egestas metus. Aenean fermentum.,98,2022-11-03T22:01:08+01:00,2022-11-04T08:01:08+01:00
73,Nulla ac enim.,92,2021-05-05T08:25:14+02:00,2021-05-05T11:25:14+02:00
74,Proin eu mi. Nulla ac enim.,148,2022-04-16T00:06:06+02:00,2022-04-16T18:06:06+02:00
75,"Curabitur in libero ut massa volutpat convallis. Morbi odio odio, elementum eu, interdum eu, tincidunt in, leo. Maecenas pulvinar lobortis est.",77,2022-06-24T01:07:17+02:00,2022-06-25T01:07:17+02:00
76,Nulla ac enim.,67,2021-11-28T04:30:32+01:00,2021-11-28T22:30:32+01:00
77,Morbi a ipsum.,189,2022-02-22T14:05:48+01:00,2022-02-22T20:05:48+01:00
78,In congue.,158,2022-02-15T13:16:09+01:00,2022-02-16T10:16:09+01:00
79,Donec posuere metus vitae ipsum.,11,2021-11-30T15:53:56+01:00,2021-12-01T12:53:56+01:00
80,Nullam varius. Nulla facilisi. Cras non velit nec nisi vulputate nonummy.,18,2022-10-23T13:11:32+02:00,2022-10-24T00:11:32+02:00
81,Quisque ut erat.,21,2022-07-16T22:30:27+02:00,2022-07-17T22:30:27+02:00
82,"Pellentesque ultrices mattis odio. Donec vitae nisi. Nam ultrices, libero non mattis pulvinar, nulla pede ullamcorper augue, a suscipit nulla elit ac nulla.",169,2022-06-15T07:57:49+02:00,2022-06-15T20:57:49+02:00
83,Integer ac leo. Pellentesque ultrices mattis odio. Donec vitae nisi.,30,2022-03-03T14:47:00+01:00,2022-03-04T08:47:00+01:00
84,In hac habitasse platea dictumst. Etiam faucibus cursus urna. Ut tellus.,109,2021-11-22T12:50:24+01:00,2021-11-22T16:50:24+01:00
85,In congue.,129,2022-12-08T17:00:48+01:00,2022-12-09T16:00:48+01:00
86,"Nam ultrices, libero non mattis pulvinar, nulla pede ullamcorper augue, a suscipit nulla elit ac nulla. Sed vel enim sit amet nunc viverra dapibus.",72,2021-08-28T05:49:02+02:00,2021-08-29T00:49:02+02:00
87,Donec ut mauris eget massa tempor convallis.,74,2021-09-05T03:21:01+02:00,2021-09-06T00:21:01+02:00
88,"Mauris enim leo, rhoncus sed, vestibulum sit amet, cursus id, turpis.",122,2022-08-14T18:50:23+02:00,2022-08-14T21:50:23+02:00
89,In sagittis dui vel nisl.,69,2022-10-11T10:48:27+02:00,2022-10-11T20:48:27+02:00
90,Ut tellus. Nulla ut erat id mauris vulputate elementum. Nullam varius.,35,2022-05-23T06:35:03+02:00,2022-05-24T05:35:03+02:00
91,Curabitur in libero ut massa volutpat convallis.,60,2022-09-26T08:26:27+02:00,2022-09-26T15:26:27+02:00
92,Praesent lectus.,29,2022-05-27T15:06:30+02:00,2022-05-27T19:06:30+02:00
93,Proin interdum mauris non ligula pellentesque ultrices. Phasellus id sapien in sapien iaculis congue.,132,2022-08-01T07:36:23+02:00,2022-08-02T04:36:23+02:00
94,"Suspendisse potenti. Cras in purus eu magna vulputate luctus. Cum sociis natoque penatibus et magnis dis parturient montes, nascetur ridiculus mus.",142,2021-09-26T05:52:25+02:00,2021-09-26T14:52:25+02:00
95,Suspendisse accumsan tortor quis turpis. Sed ante. Vivamus tortor.,125,2022-10-07T01:23:22+02:00,2022-10-07T09:23:22+02:00
96,Suspendisse potenti. Nullam porttitor lacus at turpis. Donec posuere metus vitae ipsum.,65,2022-02-06T21:55:59+01:00,2022-02-07T08:55:59+01:00
97,Curabitur convallis.,130,2022-05-07T16:45:10+02:00,2022-05-08T15:45:10+02:00
98,Phasellus sit amet erat.,151,2022-11-04T18:35:10+01:00,2022-11-05T07:35:10+01:00
99,Etiam faucibus cursus urna. Ut tellus.,131,2022-11-16T10:06:50+01:00,2022-11-16T12:06:50+01:00
100,"Vestibulum ante ipsum primis in faucibus orci luctus et ultrices posuere cubilia Curae; Donec pharetra, magna vestibulum aliquet ultrices, erat tortor sollicitudin mi, sit amet lobortis sapien sapien non mi.",26,2022-07-13T16:24:18+02:00,2022-07-14T09:24:18+02:00
101,Ut tellus. Nulla ut erat id mauris vulputate elementum. Nullam varius.,102,2023-01-09T10:44:01+01:00,2023-01-09T10:44:01+01:00
102,In hac habitasse platea dictumst. Etiam faucibus cursus urna.,41,2022-08-11T23:29:38+02:00,2022-08-12T19:29:38+02:00
103,"Donec odio justo, sollicitudin ut, suscipit a, feugiat et, eros. Vestibulum ac est lacinia nisi venenatis tristique.",137,2022-07-30T00:23:07+02:00,2022-07-30T11:23:07+02:00
104,Suspendisse potenti.,3,2021-10-26T04:44:08+02:00,2021-10-27T01:44:08+02:00
105,Etiam justo. Etiam pretium iaculis justo.,55,2021-09-21T17:14:42+02:00,2021-09-22T16:14:42+02:00
106,Morbi a ipsum.,51,2022-03-24T07:02:29+01:00,2022-03-24T15:02:29+01:00
107,"Maecenas rhoncus aliquam lacus. Morbi quis tortor id nulla ultrices aliquet. Maecenas leo odio, condimentum id, luctus nec, molestie sed, justo.",155,2021-11-27T19:29:23+01:00,2021-11-27T23:29:23+01:00
108,"Quisque erat eros, viverra eget, congue eget, semper rutrum, nulla. Nunc purus. Phasellus in felis.",6,2022-08-10T15:00:07+02:00,2022-08-11T02:00:07+02:00
109,"Donec odio justo, sollicitudin ut, suscipit a, feugiat et, eros. Vestibulum ac est lacinia nisi venenatis tristique.",200,2022-06-18T19:22:46+02:00,2022-06-19T11:22:46+02:00
110,Sed ante. Vivamus tortor. Duis mattis egestas metus.,31,2021-09-03T02:11:20+02:00,2021-09-03T14:11:20+02:00
111,Suspendisse potenti. In eleifend quam a odio.,143,2022-04-29T04:17:53+02:00,2022-04-29T15:17:53+02:00
112,"Curabitur gravida nisi at nibh. In hac habitasse platea dictumst. Aliquam augue quam, sollicitudin vitae, consectetuer eget, rutrum at, lorem.",44,2021-08-11T11:25:43+02:00,2021-08-12T05:25:43+02:00
113,Phasellus sit amet erat.,122,2023-01-11T18:16:58+01:00,2023-01-11T19:16:58+01:00
114,Quisque ut erat. Curabitur gravida nisi at nibh. In hac habitasse platea dictumst.,166,2022-05-04T22:22:00+02:00,2022-05-05T08:22:00+02:00
115,"Pellentesque ultrices mattis odio. Donec vitae nisi. Nam ultrices, libero non mattis pulvinar, nulla pede ullamcorper augue, a suscipit nulla elit ac nulla.",162,2022-12-17T16:49:40+01:00,2022-12-18T08:49:40+01:00
116,Ut at dolor quis odio consequat varius.,36,2023-02-26T16:16:27+01:00,2023-02-26T21:16:27+01:00
117,"Donec odio justo, sollicitudin ut, suscipit a, feugiat et, eros. Vestibulum ac est lacinia nisi venenatis tristique. Fusce congue, diam id ornare imperdiet, sapien urna pretium nisl, ut volutpat sapien arcu sed augue.",107,2021-11-11T03:25:19+01:00,2021-11-11T18:25:19+01:00
118,Quisque ut erat. Curabitur gravida nisi at nibh. In hac habitasse platea dictumst.,188,2022-06-02T02:01:15+02:00,2022-06-02T14:01:15+02:00
119,"Nam dui. Proin leo odio, porttitor id, consequat in, consequat ut, nulla. Sed accumsan felis.",19,2022-02-14T07:47:48+01:00,2022-02-15T04:47:48+01:00
120,Duis at velit eu est congue elementum. In hac habitasse platea dictumst.,66,2022-04-25T23:20:45+02:00,2022-04-26T20:20:45+02:00
121,"Vivamus metus arcu, adipiscing molestie, hendrerit at, vulputate vitae, nisl. Aenean lectus.",22,2021-07-26T10:07:17+02:00,2021-07-26T10:07:17+02:00
122,"Proin risus. Praesent lectus. Vestibulum quam sapien, varius ut, blandit non, interdum in, ante.",126,2021-10-08T02:29:27+02:00,2021-10-08T03:29:27+02:00
123,"Aliquam sit amet diam in magna bibendum imperdiet. Nullam orci pede, venenatis non, sodales sed, tincidunt eu, felis. Fusce posuere felis sed lacus.",194,2022-11-11T15:33:25+01:00,2022-11-12T01:33:25+01:00
124,Donec ut dolor.,20,2022-03-02T08:27:42+01:00,2022-03-02T09:27:42+01:00
125,"Nam congue, risus semper porta volutpat, quam pede lobortis ligula, sit amet eleifend pede libero quis orci. Nullam molestie nibh in lectus.",125,2022-12-07T07:43:27+01:00,2022-12-08T01:43:27+01:00
126,"Vivamus metus arcu, adipiscing molestie, hendrerit at, vulputate vitae, nisl.",165,2021-12-28T19:11:26+01:00,2021-12-29T00:11:26+01:00
127,Duis mattis egestas metus. Aenean fermentum.,117,2022-05-12T00:31:28+02:00,2022-05-12T21:31:28+02:00
128,"Nam congue, risus semper porta volutpat, quam pede lobortis ligula, sit amet eleifend pede libero quis orci. Nullam molestie nibh in lectus.",27,2022-08-08T20:05:25+02:00,2022-08-09T02:05:25+02:00
129,Aliquam non mauris. Morbi non lectus.,133,2022-11-01T02:36:38+01:00,2022-11-01T06:36:38+01:00
130,Sed vel enim sit amet nunc viverra dapibus. Nulla suscipit ligula in lacus. Curabitur at ipsum ac tellus semper interdum.,152,2021-10-30T16:17:52+02:00,2021-10-31T02:17:52+01:00
131,Nulla ut erat id mauris vulputate elementum. Nullam varius. Nulla facilisi.,60,2022-08-06T05:44:38+02:00,2022-08-06T15:44:38+02:00
132,"Nam ultrices, libero non mattis pulvinar, nulla pede ullamcorper augue, a suscipit nulla elit ac nulla. Sed vel enim sit amet nunc viverra dapibus. Nulla suscipit ligula in lacus.",43,2022-10-18T05:31:26+02:00,2022-10-18T07:31:26+02:00
133,Proin risus. Praesent lectus.,173,2021-09-05T18:25:52+02:00,2021-09-06T16:25:52+02:00
134,"In est risus, auctor sed, tristique in, tempus sit amet, sem. Fusce consequat.",112,2022-10-17T03:33:14+02:00,2022-10-17T11:33:14+02:00
135,Etiam faucibus cursus urna.,52,2022-05-15T12:01:16+02:00,2022-05-15T15:01:16+02:00
136,"Vivamus vestibulum sagittis sapien. Cum sociis natoque penatibus et magnis dis parturient montes, nascetur ridiculus mus.",15,2022-08-07T08:33:30+02:00,2022-08-07T17:33:30+02:00
137,"Vestibulum ante ipsum primis in faucibus orci luctus et ultrices posuere cubilia Curae; Nulla dapibus dolor vel est. Donec odio justo, sollicitudin ut, suscipit a, feugiat et, eros.",91,2021-09-23T20:33:27+02:00,2021-09-24T01:33:27+02:00
138,"Morbi sem mauris, laoreet ut, rhoncus aliquet, pulvinar sed, nisl. Nunc rhoncus dui vel sem. Sed sagittis.",130,2021-10-25T01:13:34+02:00,2021-10-25T22:13:34+02:00
139,Vestibulum ante ipsum primis in faucibus orci luctus et ultrices posuere cubilia Curae; Mauris viverra diam vitae quam.,8,2022-05-14T15:44:44+02:00,2022-05-15T08:44:44+02:00
140,"Donec semper sapien a libero. Nam dui. Proin leo odio, porttitor id, consequat in, consequat ut, nulla.",38,2022-08-10T17:47:07+02:00,2022-08-11T12:47:07+02:00
141,Donec ut dolor. Morbi vel lectus in quam fringilla rhoncus.,46,2022-08-28T13:58:24+02:00,2022-08-28T17:58:24+02:00
142,Nulla ut erat id mauris vulputate elementum.,170,2023-02-11T08:03:27+01:00,2023-02-11T23:03:27+01:00
143,"In tempor, turpis nec euismod scelerisque, quam turpis adipiscing lorem, vitae mattis nibh ligula nec sem. Duis aliquam convallis nunc. Proin at turpis a pede posuere nonummy.",98,2022-08-23T21:24:59+02:00,2022-08-24T14:24:59+02:00
144,"Suspendisse potenti. Cras in purus eu magna vulputate luctus. Cum sociis natoque penatibus et magnis dis parturient montes, nascetur ridiculus mus.",179,2021-08-19T14:45:12+02:00,2021-08-20T05:45:12+02:00
145,Nulla suscipit ligula in lacus.,28,2023-02-26T05:31:11+01:00,2023-02-26T17:31:11+01:00
146,Suspendisse ornare consequat lectus.,105,2021-09-28T20:02:00+02:00,2021-09-29T09:02:00+02:00
147,Suspendisse potenti. Nullam porttitor lacus at turpis.,187,2022-04-28T05:59:13+02:00,2022-04-28T22:59:13+02:00
148,"Vivamus metus arcu, adipiscing molestie, hendrerit at, vulputate vitae, nisl. Aenean lectus. Pellentesque eget nunc.",35,2021-08-29T20:01:21+02:00,2021-08-29T20:01:21+02:00
149,"Lorem ipsum dolor sit amet, consectetuer adipiscing elit. Proin interdum mauris non ligula pellentesque ultrices. Phasellus id sapien in sapien iaculis congue.",95,2022-02-15T00:58:28+01:00,2022-02-15T07:58:28+01:00
150,Integer ac leo.,97,2022-06-18T18:21:05+02:00,2022-06-19T09:21:05+02:00
151,"Nam nulla. Integer pede justo, lacinia eget, tincidunt eget, tempus vel, pede.",171,2021-09-14T12:53:27+02:00,2021-09-15T06:53:27+02:00
152,"Nam congue, risus semper porta volutpat, quam pede lobortis ligula, sit amet eleifend pede libero quis orci. Nullam molestie nibh in lectus.",19,2021-12-22T02:55:56+01:00,2021-12-22T22:55:56+01:00
153,Integer ac leo. Pellentesque ultrices mattis odio.,176,2022-02-06T06:52:10+01:00,2022-02-07T01:52:10+01:00
154,"Maecenas leo odio, condimentum id, luctus nec, molestie sed, justo. Pellentesque viverra pede ac diam.",11,2021-07-20T00:44:53+02:00,2021-07-20T19:44:53+02:00
155,"Vivamus metus arcu, adipiscing molestie, hendrerit at, vulputate vitae, nisl.",43,2022-10-17T08:32:39+02:00,2022-10-17T12:32:39+02:00
156,Aliquam erat volutpat. In congue. Etiam justo.,79,2022-02-08T06:37:12+01:00,2022-02-08T23:37:12+01:00
157,"In sagittis dui vel nisl. Duis ac nibh. Fusce lacus purus, aliquet at, feugiat non, pretium quis, lectus.",44,2022-03-16T05:38:19+01:00,2022-03-16T05:38:19+01:00
158,"Cras mi pede, malesuada in, imperdiet et, commodo vulputate, justo. In blandit ultrices enim. Lorem ipsum dolor sit amet, consectetuer adipiscing elit.",199,2023-01-29T16:29:42+01:00,2023-01-29T16:29:42+01:00
159,"Suspendisse ornare consequat lectus. In est risus, auctor sed, tristique in, tempus sit amet, sem. Fusce consequat.",73,2022-05-16T14:36:05+02:00,2022-05-16T23:36:05+02:00
160,Vivamus in felis eu sapien cursus vestibulum. Proin eu mi. Nulla ac enim.,96,2022-06-16T08:45:21+02:00,2022-06-17T04:45:21+02:00
161,Etiam pretium iaculis justo. In hac habitasse platea dictumst. Etiam faucibus cursus urna.,154,2022-11-24T22:40:53+01:00,2022-11-24T22:40:53+01:00
162,Vestibulum rutrum rutrum neque. Aenean auctor gravida sem.,21,2022-06-28T16:32:34+02:00,2022-06-29T13:32:34+02:00
163,Ut at dolor quis odio consequat varius.,37,2021-11-01T16:25:50+01:00,2021-11-01T22:25:50+01:00
164,Nulla tellus. In sagittis dui vel nisl. Duis ac nibh.,131,2022-12-24T21:08:47+01:00,2022-12-25T09:08:47+01:00
165,Curabitur convallis. Duis consequat dui nec nisi volutpat eleifend.,69,2022-06-27T22:08:40+02:00,2022-06-27T23:08:40+02:00
166,Morbi a ipsum. Integer a nibh.,63,2022-03-29T14:22:18+02:00,2022-03-29T20:22:18+02:00
167,Vivamus vel nulla eget eros elementum pellentesque. Quisque porta volutpat erat.,17,2023-01-30T22:33:02+01:00,2023-01-31T16:33:02+01:00
168,Nulla mollis molestie lorem.,112,2022-04-20T16:30:20+02:00,2022-04-21T08:30:20+02:00
169,Aliquam quis turpis eget elit sodales scelerisque.,3,2022-08-07T01:06:47+02:00,2022-08-07T11:06:47+02:00
170,"Proin leo odio, porttitor id, consequat in, consequat ut, nulla.",168,2021-10-28T13:59:33+02:00,2021-10-29T08:59:33+02:00
171,Duis mattis egestas metus. Aenean fermentum. Donec ut mauris eget massa tempor convallis.,58,2022-06-23T08:58:31+02:00,2022-06-23T12:58:31+02:00
172,Suspendisse potenti.,86,2022-04-08T02:10:47+02:00,2022-04-08T21:10:47+02:00
173,Duis mattis egestas metus. Aenean fermentum. Donec ut mauris eget massa tempor convallis.,114,2021-07-15T14:29:51+02:00,2021-07-16T08:29:51+02:00
174,Suspendisse potenti.,27,2023-01-05T15:00:00+01:00,2023-01-05T18:00:00+01:00
175,"Sed sagittis. Nam congue, risus semper porta volutpat, quam pede lobortis ligula, sit amet eleifend pede libero quis orci.",84,2022-06-25T00:41:33+02:00,2022-06-26T00:41:33+02:00
176,Nullam sit amet turpis elementum ligula vehicula consequat. Morbi a ipsum.,51,2022-06-11T04:59:12+02:00,2022-06-11T06:59:12+02:00
177,"Donec semper sapien a libero. Nam dui. Proin leo odio, porttitor id, consequat in, consequat ut, nulla.",14,2021-09-04T08:45:26+02:00,2021-09-04T17:45:26+02:00
178,"Duis ac nibh. Fusce lacus purus, aliquet at, feugiat non, pretium quis, lectus.",148,2022-09-16T15:41:35+02:00,2022-09-16T17:41:35+02:00
179,Vivamus in felis eu sapien cursus vestibulum.,108,2022-12-31T17:19:35+01:00,2022-12-31T17:19:35+01:00
180,"In hac habitasse platea dictumst. Morbi vestibulum, velit id pretium iaculis, diam erat fermentum justo, nec condimentum neque sapien placerat ante.",196,2022-03-30T20:24:29+02:00,2022-03-31T16:24:29+02:00
181,Cras non velit nec nisi vulputate nonummy.,22,2021-12-12T06:34:11+01:00,2021-12-13T05:34:11+01:00
182,Maecenas tincidunt lacus at velit. Vivamus vel nulla eget eros elementum pellentesque. Quisque porta volutpat erat.,38,2022-07-16T13:40:04+02:00,2022-07-16T17:40:04+02:00
183,Sed ante. Vivamus tortor.,47,2022-02-23T12:36:28+01:00,2022-02-23T17:36:28+01:00
184,"Cras in purus eu magna vulputate luctus. Cum sociis natoque penatibus et magnis dis parturient montes, nascetur ridiculus mus. Vivamus vestibulum sagittis sapien.",122,2022-04-26T12:49:00+02:00,2022-04-26T14:49:00+02:00
185,Fusce consequat.,10,2022-07-09T02:48:11+02:00,2022-07-09T20:48:11+02:00
186,"In hac habitasse platea dictumst. Aliquam augue quam, sollicitudin vitae, consectetuer eget, rutrum at, lorem.",100,2022-05-24T02:39:19+02:00,2022-05-24T20:39:19+02:00
187,Integer tincidunt ante vel ipsum. Praesent blandit lacinia erat.,166,2022-08-12T03:45:01+02:00,2022-08-13T01:45:01+02:00
188,Aliquam quis turpis eget elit sodales scelerisque. Mauris sit amet eros. Suspendisse accumsan tortor quis turpis.,80,2022-07-09T22:42:07+02:00,2022-07-10T19:42:07+02:00
189,"In est risus, auctor sed, tristique in, tempus sit amet, sem. Fusce consequat. Nulla nisl.",35,2021-09-04T17:31:43+02:00,2021-09-04T18:31:43+02:00
