id,content,creator_id,date_created,date_modified
732,"Donec diam neque, vestibulum eget, vulputate ut, ultrices vel, augue.",38,2021-09-29T00:20:16+02:00,2021-09-29T04:20:16+02:00
733,"Curabitur gravida nisi at nibh. In hac habitasse platea dictumst. Aliquam augue quam, sollicitudin vitae, consectetuer eget, rutrum at, lorem.",118,2022-07-14T16:03:16+02:00,2022-07-14T16:03:16+02:00
734,Sed ante. Vivamus tortor. Duis mattis egestas metus.,80,2022-05-13T09:24:45+02:00,2022-05-14T04:24:45+02:00
735,Pellentesque at nulla. Suspendisse potenti.,59,2021-11-01T00:54:48+01:00,2021-11-01T05:54:48+01:00
736,"Quisque arcu libero, rutrum ac, lobortis vel, dapibus at, diam. Nam tristique tortor eu pede.",185,2021-12-22T12:37:47+01:00,2021-12-22T18:37:47+01:00
737,Sed ante. Vivamus tortor. Duis mattis egestas metus.,70,2022-10-16T17:34:38+02:00,2022-10-17T04:34:38+02:00
738,"Suspendisse potenti. Cras in purus eu magna vulputate luctus. Cum sociis natoque penatibus et magnis dis parturient montes, nascetur ridiculus mus.",114,2021-11-21T14:38:02+01:00,2021-11-21T23:38:02+01:00
739,"Nullam orci pede, venenatis non, sodales sed, tincidunt eu, felis. Fusce posuere felis sed lacus.",193,2021-10-05T14:37:14+02:00,2021-10-05T14:37:14+02:00
740,Etiam justo. Etiam pretium iaculis justo. In hac habitasse platea dictumst.,62,2022-06-05T12:54:07+02:00,2022-06-05T17:54:07+02:00
741,"Praesent blandit. Nam nulla. Integer pede justo, lacinia eget, tincidunt eget, tempus vel, pede.",162,2022-07-27T12:30:44+02:00,2022-07-28T02:30:44+02:00
742,Etiam justo.,191,2022-09-04T12:48:01+02:00,2022-09-04T22:48:01+02:00
743,Mauris ullamcorper purus sit amet nulla.,7,2022-07-20T16:51:56+02:00,2022-07-21T01:51:56+02:00
744,Maecenas rhoncus aliquam lacus. Morbi quis tortor id nulla ultrices aliquet.,75,2022-01-21T11:28:33+01:00,2022-01-21T17:28:33+01:00
745,Quisque id justo sit amet sapien dignissim vestibulum. Vestibulum ante ipsum primis in faucibus orci luctus et ultrices posuere cubilia Curae; Nulla dapibus dolor vel est.,148,2022-09-29T19:39:39+02:00,2022-09-29T19:39:39+02:00
746,Nullam sit amet turpis elementum ligula vehicula consequat.,12,2022-08-01T16:18:34+02:00,2022-08-02T05:18:34+02:00
747,"Curabitur gravida nisi at nibh. In hac habitasse platea dictumst. Aliquam augue quam, sollicitudin vitae, consectetuer eget, rutrum at, lorem.",150,2022-05-24T01:03:00+02:00,2022-05-24T01:03:00+02:00
748,"Morbi sem mauris, laoreet ut, rhoncus aliquet, pulvinar sed, nisl. Nunc rhoncus dui vel sem. Sed sagittis.",190,2022-06-23T10:53:56+02:00,2022-06-23T15:53:56+02:00
749,Suspendisse potenti. In eleifend quam a odio.,15,2021-11-03T03:03:44+01:00,2021-11-03T05:03:44+01:00
750,Nulla justo. Aliquam quis turpis eget elit sodales scelerisque. Mauris sit amet eros.,13,2022-03-10T12:58:27+01:00,2022-03-11T10:58:27+01:00
751,Suspendisse potenti. Nullam porttitor lacus at turpis. Donec posuere metus vitae ipsum.,113,2023-01-28T06:37:59+01:00,2023-01-28T07:37:59+01:00
752,"Donec odio justo, sollicitudin ut, suscipit a, feugiat et, eros. Vestibulum ac est lacinia nisi venenatis tristique.",122,2023-01-18T05:39:38+01:00,2023-01-18T06:39:38+01:00
753,Nunc nisl.,31,2022-06-15T20:47:28+02:00,2022-06-16T17:47:28+02:00
754,"Vivamus vestibulum sagittis sapien. Cum sociis natoque penatibus et magnis dis parturient montes, nascetur ridiculus mus. Etiam vel augue.",149,2021-12-26T20:20:35+01:00,2021-12-27T05:20:35+01:00
755,"Mauris ullamcorper purus sit amet nulla. Quisque arcu libero, rutrum ac, lobortis vel, dapibus at, diam.",92,2021-07-04T10:43:12+02:00,2021-07-05T00:43:12+02:00
756,Nulla tempus.,81,2021-11-21T07:52:39+01:00,2021-11-21T17:52:39+01:00
757,"Proin interdum mauris non ligula pellentesque ultrices. Phasellus id sapien in sapien iaculis congue. Vivamus metus arcu, adipiscing molestie, hendrerit at, vulputate vitae, nisl.",27,2022-07-09T14:43:54+02:00,2022-07-09T21:43:54+02:00
758,Aenean fermentum.,42,2021-08-10T06:21:43+02:00,2021-08-11T05:21:43+02:00
759,Suspendisse accumsan tortor quis turpis.,137,2022-11-22T01:49:13+01:00,2022-11-22T17:49:13+01:00
760,Duis bibendum. Morbi non quam nec dui luctus rutrum.,116,2022-02-15T20:02:18+01:00,2022-02-15T20:02:18+01:00
761,Sed vel enim sit amet nunc viverra dapibus.,184,2022-01-18T17:49:29+01:00,2022-01-19T09:49:29+01:00
762,Nam dui.,144,2022-06-13T01:33:38+02:00,2022-06-13T17:33:38+02:00
763,Mauris sit amet eros.,29,2022-05-31T07:07:32+02:00,2022-05-31T11:07:32+02:00
764,Aliquam erat volutpat. In congue.,168,2021-10-15T19:22:36+02:00,2021-10-16T10:22:36+02:00
765,"Pellentesque viverra pede ac diam. Cras pellentesque volutpat dui. Maecenas tristique, est et tempus semper, est quam pharetra magna, ac consequat metus sapien ut nunc.",141,2022-05-11T14:52:55+02:00,2022-05-12T02:52:55+02:00
766,"Donec odio justo, sollicitudin ut, suscipit a, feugiat et, eros. Vestibulum ac est lacinia nisi venenatis tristique.",18,2022-07-14T22:35:42+02:00,2022-07-15T02:35:42+02:00
767,In congue. Etiam justo.,90,2022-08-05T01:44:21+02:00,2022-08-05T22:44:21+02:00
768,Donec dapibus. Duis at velit eu est congue elementum.,30,2022-07-12T07:13:31+02:00,2022-07-12T21:13:31+02:00
769,Aliquam erat volutpat. In congue.,172,2022-05-21T19:38:48+02:00,2022-05-22T19:38:48+02:00
770,"Donec semper sapien a libero. Nam dui. Proin leo odio, porttitor id, consequat in, consequat ut, nulla.",110,2022-05-12T08:41:17+02:00,2022-05-12T23:41:17+02:00
771,Mauris lacinia sapien quis libero. Nullam sit amet turpis elementum ligula vehicula consequat. Morbi a ipsum.,139,2022-02-04T04:47:02+01:00,2022-02-04T05:47:02+01:00
772,Phasellus sit amet erat. Nulla tempus.,15,2022-08-20T07:05:57+02:00,2022-08-20T12:05:57+02:00
773,"Integer non velit. Donec diam neque, vestibulum eget, vulputate ut, ultrices vel, augue.",107,2021-12-07T08:48:56+01:00,2021-12-08T04:48:56+01:00
774,Nunc nisl.,174,2022-07-04T14:03:38+02:00,2022-07-05T02:03:38+02:00
775,"In est risus, auctor sed, tristique in, tempus sit amet, sem. Fusce consequat. Nulla nisl.",75,2022-04-11T19:26:20+02:00,2022-04-12T01:26:20+02:00
776,Duis consequat dui nec nisi volutpat eleifend.,100,2021-07-31T15:09:49+02:00,2021-08-01T10:09:49+02:00
777,"Morbi quis tortor id nulla ultrices aliquet. Maecenas leo odio, condimentum id, luctus nec, molestie sed, justo.",119,2022-04-13T06:39:54+02:00,2022-04-13T23:39:54+02:00
778,Phasellus in felis.,103,2021-09-25T17:46:40+02:00,2021-09-26T02:46:40+02:00
779,Nulla facilisi. Cras non velit nec nisi vulputate nonummy.,156,2023-01-30T17:58:13+01:00,2023-01-30T20:58:13+01:00
780,Aliquam quis turpis eget elit sodales scelerisque. Mauris sit amet eros. Suspendisse accumsan tortor quis turpis.,160,2022-05-19T01:00:31+02:00,2022-05-19T11:00:31+02:00
781,"Integer non velit. Donec diam neque, vestibulum eget, vulputate ut, ultrices vel, augue. Vestibulum ante ipsum primis in faucibus orci luctus et ultrices posuere cubilia Curae; Donec pharetra, magna vestibulum aliquet ultrices, erat tortor sollicitudin mi, sit amet lobortis sapien sapien non mi.",11,2021-08-09T05:13:35+02:00,2021-08-09T17:13:35+02:00
782,"Vestibulum ante ipsum primis in faucibus orci luctus et ultrices posuere cubilia Curae; Donec pharetra, magna vestibulum aliquet ultrices, erat tortor sollicitudin mi, sit amet lobortis sapien sapien non mi. Integer ac neque.",34,2021-12-15T14:46:38+01:00,2021-12-16T10:46:38+01:00
783,Suspendisse potenti.,115,2022-02-23T15:05:40+01:00,2022-02-24T10:05:40+01:00
784,"Integer aliquet, massa id lobortis convallis, tortor risus dapibus augue, vel accumsan tellus nisi eu orci. Mauris lacinia sapien quis libero.",175,2022-03-29T22:04:58+02:00,2022-03-30T06:04:58+02:00
785,Etiam pretium iaculis justo.,109,2021-11-01T05:03:12+01:00,2021-11-01T20:03:12+01:00
786,Proin at turpis a pede posuere nonummy. Integer non velit.,118,2022-03-21T14:22:49+01:00,2022-03-21T15:22:49+01:00
787,Curabitur at ipsum ac tellus semper interdum. Mauris ullamcorper purus sit amet nulla.,72,2022-02-06T11:24:35+01:00,2022-02-07T04:24:35+01:00
788,Vestibulum ante ipsum primis in faucibus orci luctus et ultrices posuere cubilia Curae; Nulla dapibus dolor vel est.,171,2022-03-12T22:59:04+01:00,2022-03-13T07:59:04+01:00
789,In sagittis dui vel nisl. Duis ac nibh.,177,2022-07-24T14:54:00+02:00,2022-07-25T06:54:00+02:00
790,"Nullam orci pede, venenatis non, sodales sed, tincidunt eu, felis.",152,2022-05-20T23:38:35+02:00,2022-05-21T06:38:35+02:00
791,"Proin leo odio, porttitor id, consequat in, consequat ut, nulla. Sed accumsan felis.",67,2022-06-07T02:18:46+02:00,2022-06-07T14:18:46+02:00
792,"Nunc rhoncus dui vel sem. Sed sagittis. Nam congue, risus semper porta volutpat, quam pede lobortis ligula, sit amet eleifend pede libero quis orci.",62,2022-04-21T08:43:55+02:00,2022-04-22T05:43:55+02:00
793,Duis at velit eu est congue elementum. In hac habitasse platea dictumst.,66,2022-04-09T03:24:18+02:00,2022-04-09T03:24:18+02:00
794,Duis bibendum.,20,2021-11-05T22:06:54+01:00,2021-11-06T22:06:54+01:00
795,"Nam nulla. Integer pede justo, lacinia eget, tincidunt eget, tempus vel, pede.",148,2022-04-30T08:57:50+02:00,2022-04-30T23:57:50+02:00
796,"Nullam orci pede, venenatis non, sodales sed, tincidunt eu, felis.",33,2022-11-12T17:30:10+01:00,2022-11-13T09:30:10+01:00
797,"Quisque arcu libero, rutrum ac, lobortis vel, dapibus at, diam.",140,2022-05-31T07:52:27+02:00,2022-05-31T07:52:27+02:00
798,"Donec vitae nisi. Nam ultrices, libero non mattis pulvinar, nulla pede ullamcorper augue, a suscipit nulla elit ac nulla. Sed vel enim sit amet nunc viverra dapibus.",10,2022-06-03T16:47:54+02:00,2022-06-03T19:47:54+02:00
799,"Aenean fermentum. Donec ut mauris eget massa tempor convallis. Nulla neque libero, convallis eget, eleifend luctus, ultricies eu, nibh.",145,2021-10-26T20:34:44+02:00,2021-10-27T17:34:44+02:00
800,Integer ac neque.,108,2022-10-31T07:45:41+01:00,2022-10-31T12:45:41+01:00
801,Fusce consequat.,112,2022-11-18T05:42:57+01:00,2022-11-18T19:42:57+01:00
802,"Vivamus metus arcu, adipiscing molestie, hendrerit at, vulputate vitae, nisl.",68,2021-09-27T16:40:10+02:00,2021-09-27T23:40:10+02:00
803,Praesent blandit lacinia erat.,133,2023-01-31T01:37:50+01:00,2023-01-31T01:37:50+01:00
804,"Aliquam sit amet diam in magna bibendum imperdiet. Nullam orci pede, venenatis non, sodales sed, tincidunt eu, felis.",27,2022-09-15T04:01:38+02:00,2022-09-15T07:01:38+02:00
805,Suspendisse potenti. Nullam porttitor lacus at turpis. Donec posuere metus vitae ipsum.,58,2021-10-18T15:36:07+02:00,2021-10-19T08:36:07+02:00
806,"Cum sociis natoque penatibus et magnis dis parturient montes, nascetur ridiculus mus. Etiam vel augue. Vestibulum rutrum rutrum neque.",16,2021-11-21T21:22:37+01:00,2021-11-22T07:22:37+01:00
807,Donec semper sapien a libero.,143,2022-10-02T07:58:47+02:00,2022-10-03T06:58:47+02:00
808,Suspendisse potenti. Nullam porttitor lacus at turpis.,157,2023-02-17T15:10:15+01:00,2023-02-17T19:10:15+01:00
809,Etiam pretium iaculis justo. In hac habitasse platea dictumst.,173,2022-05-06T22:57:24+02:00,2022-05-07T15:57:24+02:00
810,Nullam molestie nibh in lectus. Pellentesque at nulla. Suspendisse potenti.,158,2021-10-30T22:46:29+02:00,2021-10-31T04:46:29+01:00
811,Maecenas ut massa quis augue luctus tincidunt. Nulla mollis molestie lorem. Quisque ut erat.,98,2022-04-06T16:25:06+02:00,2022-04-06T17:25:06+02:00
812,Nulla facilisi. Cras non velit nec nisi vulputate nonummy.,66,2023-03-11T01:58:07+01:00,2023-03-11T20:58:07+01:00
813,Ut tellus. Nulla ut erat id mauris vulputate elementum. Nullam varius.,41,2022-05-01T23:11:39+02:00,2022-05-02T02:11:39+02:00
814,Vestibulum sed magna at nunc commodo placerat. Praesent blandit. Nam nulla.,155,2022-05-09T02:12:13+02:00,2022-05-09T12:12:13+02:00
815,"Donec semper sapien a libero. Nam dui. Proin leo odio, porttitor id, consequat in, consequat ut, nulla.",35,2022-02-14T15:45:49+01:00,2022-02-15T01:45:49+01:00
816,Suspendisse ornare consequat lectus.,79,2021-10-25T17:25:42+02:00,2021-10-26T02:25:42+02:00
817,"Quisque arcu libero, rutrum ac, lobortis vel, dapibus at, diam.",165,2022-03-29T17:21:52+02:00,2022-03-30T06:21:52+02:00
818,Nunc nisl.,163,2022-06-02T04:37:51+02:00,2022-06-02T07:37:51+02:00
819,"Praesent lectus. Vestibulum quam sapien, varius ut, blandit non, interdum in, ante.",4,2023-01-04T05:52:31+01:00,2023-01-04T07:52:31+01:00
820,"Aliquam sit amet diam in magna bibendum imperdiet. Nullam orci pede, venenatis non, sodales sed, tincidunt eu, felis.",142,2022-02-16T09:14:33+01:00,2022-02-16T14:14:33+01:00
821,"Cras in purus eu magna vulputate luctus. Cum sociis natoque penatibus et magnis dis parturient montes, nascetur ridiculus mus. Vivamus vestibulum sagittis sapien.",172,2022-07-30T19:26:23+02:00,2022-07-31T02:26:23+02:00
822,Proin eu mi.,94,2021-10-19T11:39:39+02:00,2021-10-19T23:39:39+02:00
823,Duis bibendum.,52,2022-05-09T10:09:30+02:00,2022-05-09T11:09:30+02:00
824,In congue.,138,2022-04-01T06:20:42+02:00,2022-04-02T01:20:42+02:00
825,Donec posuere metus vitae ipsum.,162,2022-12-04T09:00:50+01:00,2022-12-05T05:00:50+01:00
826,"Maecenas leo odio, condimentum id, luctus nec, molestie sed, justo. Pellentesque viverra pede ac diam.",43,2022-05-16T06:48:07+02:00,2022-05-16T21:48:07+02:00
827,Phasellus in felis. Donec semper sapien a libero. Nam dui.,199,2022-12-07T19:22:00+01:00,2022-12-08T02:22:00+01:00
828,Nulla mollis molestie lorem.,37,2021-10-31T01:54:47+02:00,2021-10-31T11:54:47+01:00
829,Quisque id justo sit amet sapien dignissim vestibulum. Vestibulum ante ipsum primis in faucibus orci luctus et ultrices posuere cubilia Curae; Nulla dapibus dolor vel est.,197,2022-01-12T14:19:07+01:00,2022-01-12T21:19:07+01:00
830,Suspendisse potenti. Nullam porttitor lacus at turpis.,109,2021-10-21T01:45:27+02:00,2021-10-21T07:45:27+02:00
831,Nulla nisl. Nunc nisl.,1,2022-09-19T00:09:19+02:00,2022-09-19T17:09:19+02:00
832,Mauris ullamcorper purus sit amet nulla.,3,2022-03-20T02:59:43+01:00,2022-03-20T09:59:43+01:00
833,Nam tristique tortor eu pede.,183,2021-12-18T23:55:14+01:00,2021-12-19T18:55:14+01:00
834,Nullam molestie nibh in lectus.,180,2021-09-25T11:34:29+02:00,2021-09-26T00:34:29+02:00
835,Etiam pretium iaculis justo. In hac habitasse platea dictumst.,129,2022-08-02T02:19:25+02:00,2022-08-03T02:19:25+02:00
836,Praesent blandit lacinia erat. Vestibulum sed magna at nunc commodo placerat.,123,2022-10-04T15:21:40+02:00,2022-10-04T23:21:40+02:00
837,"Morbi odio odio, elementum eu, interdum eu, tincidunt in, leo. Maecenas pulvinar lobortis est. Phasellus sit amet erat.",73,2021-10-13T03:09:03+02:00,2021-10-13T12:09:03+02:00
838,Maecenas tincidunt lacus at velit. Vivamus vel nulla eget eros elementum pellentesque. Quisque porta volutpat erat.,100,2021-10-26T18:13:32+02:00,2021-10-27T11:13:32+02:00
839,Pellentesque viverra pede ac diam.,195,2021-07-17T11:41:00+02:00,2021-07-17T15:41:00+02:00
840,Phasellus in felis. Donec semper sapien a libero. Nam dui.,85,2021-10-20T09:14:58+02:00,2021-10-20T13:14:58+02:00
841,Suspendisse accumsan tortor quis turpis. Sed ante. Vivamus tortor.,121,2022-04-12T19:24:15+02:00,2022-04-13T06:24:15+02:00
842,Curabitur at ipsum ac tellus semper interdum.,65,2022-07-13T14:08:08+02:00,2022-07-14T00:08:08+02:00
843,"Fusce congue, diam id ornare imperdiet, sapien urna pretium nisl, ut volutpat sapien arcu sed augue. Aliquam erat volutpat.",6,2022-02-28T11:43:32+01:00,2022-02-28T22:43:32+01:00
844,"In tempor, turpis nec euismod scelerisque, quam turpis adipiscing lorem, vitae mattis nibh ligula nec sem. Duis aliquam convallis nunc. Proin at turpis a pede posuere nonummy.",176,2022-06-22T01:49:36+02:00,2022-06-22T21:49:36+02:00
845,Proin eu mi. Nulla ac enim.,76,2022-02-07T02:16:50+01:00,2022-02-07T03:16:50+01:00
846,"Lorem ipsum dolor sit amet, consectetuer adipiscing elit. Proin interdum mauris non ligula pellentesque ultrices. Phasellus id sapien in sapien iaculis congue.",151,2022-09-05T11:26:36+02:00,2022-09-05T13:26:36+02:00
847,"Lorem ipsum dolor sit amet, consectetuer adipiscing elit.",189,2022-04-25T20:30:45+02:00,2022-04-26T03:30:45+02:00
848,"Fusce lacus purus, aliquet at, feugiat non, pretium quis, lectus.",33,2022-12-13T21:05:23+01:00,2022-12-14T05:05:23+01:00
849,"Fusce lacus purus, aliquet at, feugiat non, pretium quis, lectus.",127,2022-09-27T19:23:38+02:00,2022-09-28T00:23:38+02:00
850,"Morbi sem mauris, laoreet ut, rhoncus aliquet, pulvinar sed, nisl.",10,2022-07-02T22:05:23+02:00,2022-07-03T19:05:23+02:00
851,"Integer pede justo, lacinia eget, tincidunt eget, tempus vel, pede. Morbi porttitor lorem id ligula. Suspendisse ornare consequat lectus.",172,2022-01-31T15:50:10+01:00,2022-01-31T16:50:10+01:00
852,"In hac habitasse platea dictumst. Aliquam augue quam, sollicitudin vitae, consectetuer eget, rutrum at, lorem. Integer tincidunt ante vel ipsum.",90,2022-09-18T16:36:21+02:00,2022-09-19T05:36:21+02:00
853,Suspendisse potenti. Nullam porttitor lacus at turpis.,174,2022-03-15T09:34:07+01:00,2022-03-16T06:34:07+01:00
854,Suspendisse potenti. Nullam porttitor lacus at turpis.,51,2021-11-17T10:29:24+01:00,2021-11-17T23:29:24+01:00
855,"Pellentesque viverra pede ac diam. Cras pellentesque volutpat dui. Maecenas tristique, est et tempus semper, est quam pharetra magna, ac consequat metus sapien ut nunc.",129,2022-09-24T22:40:55+02:00,2022-09-25T13:40:55+02:00
856,Etiam justo.,81,2021-10-16T13:15:25+02:00,2021-10-16T14:15:25+02:00
857,"Aliquam sit amet diam in magna bibendum imperdiet. Nullam orci pede, venenatis non, sodales sed, tincidunt eu, felis. Fusce posuere felis sed lacus.",16,2022-04-18T18:23:47+02:00,2022-04-19T04:23:47+02:00
858,Vivamus tortor. Duis mattis egestas metus. Aenean fermentum.,162,2023-02-01T02:13:08+01:00,2023-02-01T20:13:08+01:00
859,In congue.,41,2021-12-30T17:02:54+01:00,2021-12-31T15:02:54+01:00
860,Nullam porttitor lacus at turpis. Donec posuere metus vitae ipsum. Aliquam non mauris.,119,2022-09-23T03:25:30+02:00,2022-09-23T17:25:30+02:00
861,"Morbi porttitor lorem id ligula. Suspendisse ornare consequat lectus. In est risus, auctor sed, tristique in, tempus sit amet, sem.",154,2022-09-09T08:09:41+02:00,2022-09-10T08:09:41+02:00
862,Nulla tempus.,103,2022-01-23T03:32:41+01:00,2022-01-24T01:32:41+01:00
863,"Pellentesque viverra pede ac diam. Cras pellentesque volutpat dui. Maecenas tristique, est et tempus semper, est quam pharetra magna, ac consequat metus sapien ut nunc.",127,2022-09-29T20:31:56+02:00,2022-09-30T17:31:56+02:00
864,"Morbi non lectus. Aliquam sit amet diam in magna bibendum imperdiet. Nullam orci pede, venenatis non, sodales sed, tincidunt eu, felis.",149,2022-05-25T16:57:50+02:00,2022-05-25T16:57:50+02:00
865,"In est risus, auctor sed, tristique in, tempus sit amet, sem. Fusce consequat.",102,2023-01-14T07:16:43+01:00,2023-01-14T08:16:43+01:00
866,Integer tincidunt ante vel ipsum.,112,2022-10-22T13:24:49+02:00,2022-10-23T09:24:49+02:00
867,Donec quis orci eget orci vehicula condimentum. Curabitur in libero ut massa volutpat convallis.,151,2022-03-22T06:51:19+01:00,2022-03-23T00:51:19+01:00
868,Proin risus.,173,2022-04-11T23:09:03+02:00,2022-04-12T15:09:03+02:00
869,"Suspendisse ornare consequat lectus. In est risus, auctor sed, tristique in, tempus sit amet, sem.",199,2022-11-12T05:39:02+01:00,2022-11-12T18:39:02+01:00
870,"Praesent blandit. Nam nulla. Integer pede justo, lacinia eget, tincidunt eget, tempus vel, pede.",31,2021-12-14T22:38:48+01:00,2021-12-15T12:38:48+01:00
871,Nulla ut erat id mauris vulputate elementum. Nullam varius. Nulla facilisi.,2,2021-05-03T15:30:36+02:00,2021-05-04T01:30:36+02:00
872,Donec dapibus.,47,2022-01-31T10:57:40+01:00,2022-01-31T21:57:40+01:00
873,In eleifend quam a odio. In hac habitasse platea dictumst.,49,2022-01-29T21:53:09+01:00,2022-01-30T11:53:09+01:00
874,"Duis at velit eu est congue elementum. In hac habitasse platea dictumst. Morbi vestibulum, velit id pretium iaculis, diam erat fermentum justo, nec condimentum neque sapien placerat ante.",123,2022-10-24T20:24:55+02:00,2022-10-25T06:24:55+02:00
875,Curabitur at ipsum ac tellus semper interdum.,145,2022-01-16T17:04:47+01:00,2022-01-16T22:04:47+01:00
876,"Proin at turpis a pede posuere nonummy. Integer non velit. Donec diam neque, vestibulum eget, vulputate ut, ultrices vel, augue.",166,2023-04-01T00:11:21+02:00,2023-04-01T01:11:21+02:00
877,"Proin at turpis a pede posuere nonummy. Integer non velit. Donec diam neque, vestibulum eget, vulputate ut, ultrices vel, augue.",195,2021-12-28T19:52:12+01:00,2021-12-29T13:52:12+01:00
878,Donec dapibus. Duis at velit eu est congue elementum. In hac habitasse platea dictumst.,35,2021-11-09T10:55:01+01:00,2021-11-09T18:55:01+01:00
879,Phasellus sit amet erat.,56,2021-10-30T18:25:28+02:00,2021-10-30T20:25:28+02:00
880,Etiam justo. Etiam pretium iaculis justo. In hac habitasse platea dictumst.,80,2022-03-18T12:53:59+01:00,2022-03-18T14:53:59+01:00
881,Nunc rhoncus dui vel sem. Sed sagittis.,63,2022-02-22T11:46:11+01:00,2022-02-23T07:46:11+01:00
882,Nulla facilisi. Cras non velit nec nisi vulputate nonummy.,121,2021-09-08T06:22:33+02:00,2021-09-08T12:22:33+02:00
883,Fusce consequat.,30,2022-10-10T09:56:59+02:00,2022-10-10T19:56:59+02:00
884,"Vestibulum quam sapien, varius ut, blandit non, interdum in, ante. Vestibulum ante ipsum primis in faucibus orci luctus et ultrices posuere cubilia Curae; Duis faucibus accumsan odio.",196,2022-04-13T19:56:59+02:00,2022-04-14T12:56:59+02:00
885,"Mauris enim leo, rhoncus sed, vestibulum sit amet, cursus id, turpis.",13,2022-02-14T01:40:40+01:00,2022-02-14T11:40:40+01:00
886,Integer tincidunt ante vel ipsum. Praesent blandit lacinia erat. Vestibulum sed magna at nunc commodo placerat.,168,2022-06-17T05:07:35+02:00,2022-06-17T11:07:35+02:00
887,In hac habitasse platea dictumst.,65,2022-01-17T22:13:15+01:00,2022-01-17T22:13:15+01:00
888,"Duis bibendum, felis sed interdum venenatis, turpis enim blandit mi, in porttitor pede justo eu massa. Donec dapibus. Duis at velit eu est congue elementum.",137,2022-12-18T00:50:57+01:00,2022-12-18T01:50:57+01:00
889,Donec posuere metus vitae ipsum. Aliquam non mauris. Morbi non lectus.,111,2021-11-24T23:11:49+01:00,2021-11-25T19:11:49+01:00
890,Curabitur convallis.,186,2022-10-23T18:10:18+02:00,2022-10-24T14:10:18+02:00
891,In hac habitasse platea dictumst.,122,2022-11-10T04:19:34+01:00,2022-11-10T22:19:34+01:00
892,Vestibulum sed magna at nunc commodo placerat.,10,2022-05-16T04:05:38+02:00,2022-05-17T04:05:38+02:00
893,Nulla suscipit ligula in lacus. Curabitur at ipsum ac tellus semper interdum. Mauris ullamcorper purus sit amet nulla.,67,2022-04-18T13:08:57+02:00,2022-04-19T05:08:57+02:00
894,Mauris lacinia sapien quis libero. Nullam sit amet turpis elementum ligula vehicula consequat. Morbi a ipsum.,84,2022-04-28T21:13:11+02:00,2022-04-29T12:13:11+02:00
895,Donec dapibus.,60,2022-04-24T21:33:14+02:00,2022-04-25T08:33:14+02:00
896,In eleifend quam a odio.,125,2022-05-09T14:31:30+02:00,2022-05-09T15:31:30+02:00
897,"Mauris enim leo, rhoncus sed, vestibulum sit amet, cursus id, turpis. Integer aliquet, massa id lobortis convallis, tortor risus dapibus augue, vel accumsan tellus nisi eu orci.",193,2021-10-06T01:46:03+02:00,2021-10-06T10:46:03+02:00
898,In eleifend quam a odio.,7,2023-03-05T00:58:32+01:00,2023-03-05T02:58:32+01:00
899,Integer non velit.,178,2023-02-17T23:38:16+01:00,2023-02-18T20:38:16+01:00
900,"Curabitur at ipsum ac tellus semper interdum. Mauris ullamcorper purus sit amet nulla. Quisque arcu libero, rutrum ac, lobortis vel, dapibus at, diam.",15,2022-01-03T12:57:11+01:00,2022-01-03T14:57:11+01:00
901,In hac habitasse platea dictumst. Maecenas ut massa quis augue luctus tincidunt.,140,2022-06-28T11:24:49+02:00,2022-06-29T03:24:49+02:00
902,Aliquam non mauris. Morbi non lectus.,182,2022-11-26T00:56:38+01:00,2022-11-26T18:56:38+01:00
903,"Cum sociis natoque penatibus et magnis dis parturient montes, nascetur ridiculus mus.",69,2022-03-03T16:38:13+01:00,2022-03-04T05:38:13+01:00
904,Nulla facilisi. Cras non velit nec nisi vulputate nonummy. Maecenas tincidunt lacus at velit.,23,2022-06-18T23:17:44+02:00,2022-06-19T02:17:44+02:00
905,Phasellus sit amet erat. Nulla tempus.,108,2022-12-26T13:28:49+01:00,2022-12-27T11:28:49+01:00
906,Aenean auctor gravida sem.,76,2021-10-12T20:17:59+02:00,2021-10-13T05:17:59+02:00
907,Aliquam erat volutpat.,178,2022-11-28T20:37:13+01:00,2022-11-29T20:37:13+01:00
908,Maecenas ut massa quis augue luctus tincidunt. Nulla mollis molestie lorem. Quisque ut erat.,160,2023-01-20T01:39:28+01:00,2023-01-20T01:39:28+01:00
909,Pellentesque at nulla.,110,2021-09-07T02:40:44+02:00,2021-09-07T06:40:44+02:00
910,Aliquam erat volutpat.,146,2021-12-21T17:58:36+01:00,2021-12-22T03:58:36+01:00
911,Phasellus sit amet erat.,155,2021-10-23T22:27:31+02:00,2021-10-24T09:27:31+02:00
912,"Cum sociis natoque penatibus et magnis dis parturient montes, nascetur ridiculus mus. Vivamus vestibulum sagittis sapien. Cum sociis natoque penatibus et magnis dis parturient montes, nascetur ridiculus mus.",188,2021-10-23T07:32:53+02:00,2021-10-24T01:32:53+02:00
913,Mauris sit amet eros. Suspendisse accumsan tortor quis turpis.,152,2021-07-18T19:15:46+02:00,2021-07-19T15:15:46+02:00
914,Ut at dolor quis odio consequat varius. Integer ac leo. Pellentesque ultrices mattis odio.,33,2022-02-06T09:54:16+01:00,2022-02-07T09:54:16+01:00
915,Sed sagittis.,7,2022-09-21T03:58:25+02:00,2022-09-21T13:58:25+02:00
916,"Duis ac nibh. Fusce lacus purus, aliquet at, feugiat non, pretium quis, lectus. Suspendisse potenti.",150,2022-09-25T08:57:09+02:00,2022-09-26T04:57:09+02:00
917,Phasellus sit amet erat.,17,2022-12-13T19:51:56+01:00,2022-12-13T21:51:56+01:00
918,Praesent id massa id nisl venenatis lacinia. Aenean sit amet justo.,22,2021-09-17T21:14:55+02:00,2021-09-18T07:14:55+02:00
919,"Morbi porttitor lorem id ligula. Suspendisse ornare consequat lectus. In est risus, auctor sed, tristique in, tempus sit amet, sem.",94,2021-08-03T20:37:37+02:00,2021-08-04T05:37:37+02:00
920,Proin interdum mauris non ligula pellentesque ultrices.,58,2022-08-15T01:14:41+02:00,2022-08-15T19:14:41+02:00
